,author,name,num_comments,permalink,score,selftext,stickied,subreddit,title,url
478,CHEESYNBEASTY,t3_bjov8f,4,/r/CrazyIdeas/comments/bjov8f/they_should_the_cause_of_death_on_headstones_in/,18,,False,CrazyIdeas,They should the cause of death on headstones in cemeteries to make it way more interesting.,https://www.reddit.com/r/CrazyIdeas/comments/bjov8f/they_should_the_cause_of_death_on_headstones_in/
479,vuj_ke,t3_bjz617,0,/r/CrazyIdeas/comments/bjz617/all_video_games_are_free_but_they_require_net/,0,Until you fully buy it…,False,CrazyIdeas,"All video games are free, but they require net connection and play unskippable ads every 10 minutes",https://www.reddit.com/r/CrazyIdeas/comments/bjz617/all_video_games_are_free_but_they_require_net/
480,hononononoh,t3_bjwdpw,0,/r/CrazyIdeas/comments/bjwdpw/a_world_conference_on_recreational_ketamine_use/,1,"With all the original decor up, preferably not renovated since the 90s or earlier.  Music provided by some of the most cutting edge vaporwave artists.",False,CrazyIdeas,"A world conference on recreational ketamine use, held in a recently closed down K-mart.",https://www.reddit.com/r/CrazyIdeas/comments/bjwdpw/a_world_conference_on_recreational_ketamine_use/
481,soggyramennoodle,t3_bjqcfq,2,/r/CrazyIdeas/comments/bjqcfq/get_3_identical_cats_and_name_them_all_dejavú/,9,,False,CrazyIdeas,Get 3 identical cats and name them all dejavú,https://www.reddit.com/r/CrazyIdeas/comments/bjqcfq/get_3_identical_cats_and_name_them_all_dejavú/
482,xFuriousLion1x,t3_bjtw0v,0,/r/CrazyIdeas/comments/bjtw0v/a_school_ran_on_communism/,1,,False,CrazyIdeas,A school ran on Communism,https://www.reddit.com/r/CrazyIdeas/comments/bjtw0v/a_school_ran_on_communism/
483,NukeDC,t3_bjof0a,1,/r/CrazyIdeas/comments/bjof0a/smartwatch_app_that_pauses_your_show_when_it/,15,,False,CrazyIdeas,Smartwatch app that pauses your show when it detects you've fallen asleep,https://www.reddit.com/r/CrazyIdeas/comments/bjof0a/smartwatch_app_that_pauses_your_show_when_it/
484,ThereShallBeWings,t3_bjsqgp,2,/r/CrazyIdeas/comments/bjsqgp/open_a_university_that_starts_classes_at_1pm_and/,2,"It's well known that some people are night owls and are fully functional only later in the day. Yet all Universities seem to start at 8am or 9am, which is great for early birds like me, but not great for everyone. Surely there is enough demand from enough night owls for at least one place with a later start?",False,CrazyIdeas,Open a University that starts classes at 1pm and runs into the evening,https://www.reddit.com/r/CrazyIdeas/comments/bjsqgp/open_a_university_that_starts_classes_at_1pm_and/
485,Guacodile42,t3_bjrjrb,3,/r/CrazyIdeas/comments/bjrjrb/a_browserextension_that_allows_you_to_doubleclick/,5,"It would encourage expanding your vocabulary.

It's a crazy idea since I've tried this myself and it doesn't work.  I never use the words that I collect...",False,CrazyIdeas,"A browser-extension that allows you to double-click on a word and get its definition like Google Dictionary, but there's also an option to ""save"" the word to a list so that you won't forget it. Whenever you're typing in anywhere online, you can view this list by clicking a button in the corner.",https://www.reddit.com/r/CrazyIdeas/comments/bjrjrb/a_browserextension_that_allows_you_to_doubleclick/
486,-Vybez-,t3_bjofhf,2,/r/CrazyIdeas/comments/bjofhf/someone_should_make_a_documentary_where_they_fly/,13,,False,CrazyIdeas,Someone should make a documentary where they fly a flat earth theory supporter to a space station for a couple of days.,https://www.reddit.com/r/CrazyIdeas/comments/bjofhf/someone_should_make_a_documentary_where_they_fly/
487,adullploy,t3_bjvk0k,1,/r/CrazyIdeas/comments/bjvk0k/an_ama_where_someone_answers_all_the_questions/,1,,False,CrazyIdeas,An AMA where someone answers all the questions.,https://www.reddit.com/r/CrazyIdeas/comments/bjvk0k/an_ama_where_someone_answers_all_the_questions/
488,paul_f,t3_bjojdb,3,/r/CrazyIdeas/comments/bjojdb/mess_with_texas/,14,,False,CrazyIdeas,Mess with Texas,https://www.reddit.com/r/CrazyIdeas/comments/bjojdb/mess_with_texas/
489,damiankw,t3_bjoisb,1,/r/CrazyIdeas/comments/bjoisb/spoil_television_and_movies_for_people_that_give/,13,"Create a reddit bot which hunts for people spoiling television shows and movies on purpose, put them on a hitlist for any spoilers and private message them every time a new spoiler appears with the spoiler. They will no longer be able to watch anything without already knowing what's going to happen.",False,CrazyIdeas,Spoil television and movies for people that give spoilers,https://www.reddit.com/r/CrazyIdeas/comments/bjoisb/spoil_television_and_movies_for_people_that_give/
490,Uniqueusername360,t3_bjqu3z,5,/r/CrazyIdeas/comments/bjqu3z/get_a_reflective_wet_suit_and_go_swimming_in_the/,6,,False,CrazyIdeas,Get a reflective wet suit and go swimming in the middle of the ocean.,https://www.reddit.com/r/CrazyIdeas/comments/bjqu3z/get_a_reflective_wet_suit_and_go_swimming_in_the/
491,bendanger,t3_bjqti2,4,/r/CrazyIdeas/comments/bjqti2/uber_texting_you_type_and_print_a_text_and_driver/,7,,False,CrazyIdeas,"Uber texting. You type and print a text and driver will pick it up and deliver it to the recipient, and then deliver their printed response back to you.",https://www.reddit.com/r/CrazyIdeas/comments/bjqti2/uber_texting_you_type_and_print_a_text_and_driver/
492,sensimaniak,t3_bjowai,0,/r/CrazyIdeas/comments/bjowai/an_option_to_turn_off_background_soundtracks/,11,,False,CrazyIdeas,"An option to turn off background soundtracks, laugh tracks, and just allow me to feel my own emotions, strictly based off dialogue or maybe even monologue.",https://www.reddit.com/r/CrazyIdeas/comments/bjowai/an_option_to_turn_off_background_soundtracks/
493,Pipsqueak12345,t3_bjz1qo,2,/r/CrazyIdeas/comments/bjz1qo/there_should_be_a_surgeon_who_leaves_random/,0,,False,CrazyIdeas,There should be a surgeon who leaves random equipment or stuff in their patients after each surgery,https://www.reddit.com/r/CrazyIdeas/comments/bjz1qo/there_should_be_a_surgeon_who_leaves_random/
494,ploughran89,t3_bjn1g9,4,/r/CrazyIdeas/comments/bjn1g9/if_we_call_vaccines_preantidote_or_preremedy_it/,17,,False,CrazyIdeas,"If we call vaccines pre-antidote or pre-remedy, it might be enough to change some anti-vaxxers minds. After all, the majority are idiots",https://www.reddit.com/r/CrazyIdeas/comments/bjn1g9/if_we_call_vaccines_preantidote_or_preremedy_it/
495,weirdinchicago,t3_bjreb6,2,/r/CrazyIdeas/comments/bjreb6/dress_up_as_mib_in_roswell_nm_follow_one_of_the/,5,,False,CrazyIdeas,"Dress up as MIB in Roswell NM, follow one of the nerdy UFO guys around till he confronts you, then him him in the face with a cream pie and run away.",https://www.reddit.com/r/CrazyIdeas/comments/bjreb6/dress_up_as_mib_in_roswell_nm_follow_one_of_the/
496,jsparker89,t3_bjstrj,0,/r/CrazyIdeas/comments/bjstrj/the_black_widow_movie_should_be_a_romcom_with/,2,"Johansson and Rufflo have great chemistry and an end set piece where Prof. Hulk comes out and smashes the conflict along side Black Widow kicking ass would be a great.

First act deals with the snap.

Middle is goofy Banner bumbling behind Natasha doing sneaky spy shit.

Edit: it could start a little this is 40 fighting married couple to explain why they aren't together in endgame",False,CrazyIdeas,The Black Widow movie should be a rom-com with Banner/Hulk like Mr &amp; Mrs Smith,https://www.reddit.com/r/CrazyIdeas/comments/bjstrj/the_black_widow_movie_should_be_a_romcom_with/
497,Tipsly,t3_bjow5m,4,/r/CrazyIdeas/comments/bjow5m/set_your_alarm_to_porn_noises_to_wake_up_quick/,9,,False,CrazyIdeas,Set your alarm to porn noises to wake up quick,https://www.reddit.com/r/CrazyIdeas/comments/bjow5m/set_your_alarm_to_porn_noises_to_wake_up_quick/
498,ZroZlame,t3_bjsq2s,1,/r/CrazyIdeas/comments/bjsq2s/reddit_should_have_a_tag_system_where_you_press_a/,2,,False,CrazyIdeas,"Reddit should have a tag system where you press a tag button and you enter persons to tag in a box, it mails them the post link and the number of tags is displayed next to each post/comment",https://www.reddit.com/r/CrazyIdeas/comments/bjsq2s/reddit_should_have_a_tag_system_where_you_press_a/
499,belligerentbeagle,t3_bjufya,1,/r/CrazyIdeas/comments/bjufya/teens_from_girls_home_practise_mindfulness_to/,0,"[https://www.straitstimes.com/singapore/education/teens-from-girls-home-practise-mindfulness-to-keep-calm](https://www.straitstimes.com/singapore/education/teens-from-girls-home-practise-mindfulness-to-keep-calm)

At first glance, thought they were caught torturing them given the camera angle and all.",False,CrazyIdeas,Teens from girls' home practise 'mindfulness' to keep calm,https://www.reddit.com/r/CrazyIdeas/comments/bjufya/teens_from_girls_home_practise_mindfulness_to/
500,CalLil6,t3_bjliw6,5,/r/CrazyIdeas/comments/bjliw6/instead_of_popularopinions_and_unpopularopinions/,23,,False,CrazyIdeas,"Instead of /popularopinions and /unpopularopinions, merge them into one sub called “opinions” and let the upvotes and downvotes sort them into popular/unpopular",https://www.reddit.com/r/CrazyIdeas/comments/bjliw6/instead_of_popularopinions_and_unpopularopinions/
501,deleted_acc0unt,t3_bjornh,1,/r/CrazyIdeas/comments/bjornh/in_our_lifetimes_the_children_of_today_will_be/,7,,False,CrazyIdeas,"In our lifetimes, the children of today will be fixing our bodies, making government policies, developing innovations in medicine and technology, etc. Maybe it’s in our best interest to give them the best education possible?",https://www.reddit.com/r/CrazyIdeas/comments/bjornh/in_our_lifetimes_the_children_of_today_will_be/
502,bongothespacedog,t3_bjq533,11,/r/CrazyIdeas/comments/bjq533/kid_guns/,6,"With all these school shootings happening in the US, it's pretty safe to say that they are easy targets. But what if we gave each kid a gun? Suddenly you have an inpenetrable fortress that no lunatic would ever dare to enter.",False,CrazyIdeas,Kid guns.,https://www.reddit.com/r/CrazyIdeas/comments/bjq533/kid_guns/
503,BoogsterSU2,t3_bjsb6d,1,/r/CrazyIdeas/comments/bjsb6d/put_a_tax_on_antivaxxers_every_week_for_every_one/,2,,False,CrazyIdeas,Put a tax on anti-vaxxers every week for every one of their kids who are not vaccinated. Taxes would then help fund hospitals getting new equipment and medicine.,https://www.reddit.com/r/CrazyIdeas/comments/bjsb6d/put_a_tax_on_antivaxxers_every_week_for_every_one/
504,Dheu9,t3_bjr65k,0,/r/CrazyIdeas/comments/bjr65k/create_a_minecraft_version_of_infinity_war/,3,Think about it. It could totally work. Each infinity stone corresponds with a minecraft item,False,CrazyIdeas,Create a Minecraft version of Infinity War,https://www.reddit.com/r/CrazyIdeas/comments/bjr65k/create_a_minecraft_version_of_infinity_war/
505,republicansBangKids,t3_bjxc39,18,/r/CrazyIdeas/comments/bjxc39/call_small_businesses_and_ask_them_if_they/,0,,False,CrazyIdeas,"Call small businesses and ask them if they support Trump, then let them know you only work with companies that have morals, if they say they do.",https://www.reddit.com/r/CrazyIdeas/comments/bjxc39/call_small_businesses_and_ask_them_if_they/
506,hiveuser69,t3_bjpdwh,2,/r/CrazyIdeas/comments/bjpdwh/we_should_feed_each_other/,6,"1/3 of Americans are fat. 2/3 are overweight.

One time my dog was fat so I brung my dog to the vet. She told me to feed her less. I did. She lost weight.

This gave me the brilliant idea: 

Humans should feed each other. You pour food in my bowl. And you pour food in mine.

“Oh no I’m getting fat!""

""Feed me less.""

I think this is a legit good idea. We can't control ourselves but we are good at judging each other. So we decide what each other should eat.",False,CrazyIdeas,We should feed each other,https://www.reddit.com/r/CrazyIdeas/comments/bjpdwh/we_should_feed_each_other/
507,ItIsThatGuy,t3_bjqowk,2,/r/CrazyIdeas/comments/bjqowk/a_fair_where_people_gather_to_all_act_out_one_big/,3,"I've been on this one for a while, so let me know if it exists. Like any other fair or convention, it would cost admission and have staff. Only about 10-20 people are player characters. The staff, along with volunteers, would represent NPCs. There would be around 30-50 NPCs that would serve as shopkeepers, quest givers, background civilians, and enemies. NPCs would likely have extremely boring jobs, seeing that everything they do and say around players in strictly scripted. Perhaps working as an NPC would provide your player with perks in the next round. The world you play in would be a hybrid of houses, makeshift structures, and of course forests and mountains. Players would be able to challenge each other to combat, which could be represented with a digital service that keeps track of stats. They could go on quests. Trade shit. Troll each other. Obviously this would be an extremely expensive operation, but enough people would likely support it to keep it alive.",False,CrazyIdeas,"A fair where people gather to all act out one big ""video game.""",https://www.reddit.com/r/CrazyIdeas/comments/bjqowk/a_fair_where_people_gather_to_all_act_out_one_big/
508,TiberiumKane,t3_bjszue,4,/r/CrazyIdeas/comments/bjszue/a_bar_called_puzzles_where_thats_the_puzzle/,0,,False,CrazyIdeas,A bar called Puzzles. Where that's the puzzle.,https://www.reddit.com/r/CrazyIdeas/comments/bjszue/a_bar_called_puzzles_where_thats_the_puzzle/
509,lacroixrhymeswithjoy,t3_bjpjr5,2,/r/CrazyIdeas/comments/bjpjr5/a_crowdfunding_site_but_for_getting_people_to/,5,,False,CrazyIdeas,A crowdfunding site but for getting people to contribute time to complete a proposed task or project,https://www.reddit.com/r/CrazyIdeas/comments/bjpjr5/a_crowdfunding_site_but_for_getting_people_to/
510,acneconstellation,t3_bjpjaz,1,/r/CrazyIdeas/comments/bjpjaz/crowdsource_endings_like_gots_final_season_and/,4,,False,CrazyIdeas,Crowdsource endings like GoT’s final season and The Hobbit because one fan out there is more enthralled in the lore than a hurried creator writing out of obligation instead of passion,https://www.reddit.com/r/CrazyIdeas/comments/bjpjaz/crowdsource_endings_like_gots_final_season_and/
511,ChronoAndMarle,t3_bjn55f,4,/r/CrazyIdeas/comments/bjn55f/a_lawnmower_roomba/,6,,False,CrazyIdeas,A lawnmower Roomba,https://www.reddit.com/r/CrazyIdeas/comments/bjn55f/a_lawnmower_roomba/
512,FivePercentLuck,t3_bjpk7r,1,/r/CrazyIdeas/comments/bjpk7r/chickens_are_illegal_in_my_city_if_i_had_the_dosh/,3,Egg prices would plummet,False,CrazyIdeas,"Chickens are illegal in my city, if I had the dosh I would buy tons of chickens and release them all around the city for the free eggs and just the fact that I introduced a new species",https://www.reddit.com/r/CrazyIdeas/comments/bjpk7r/chickens_are_illegal_in_my_city_if_i_had_the_dosh/
513,zaiker,t3_bjkh7h,2,/r/CrazyIdeas/comments/bjkh7h/sonics_design_in_the_new_movie_is_terrible_on/,11,"   Sonic's new movie has made a bit of a turmoil in the internet community. Many people hate it. They hate everything about it. They hate Sonic's look, down to the fact that he has two eyes instead of one giant eyeball with two pupils (Really? That one is more realistic?). They hate everything about Dr. Robitnik (except for that clip in the end, he looked good there). They hate that military is involved, how so many video game movies take place in the real world as opposed to their own individual ones, and so on and so on.

   The point being, the Internet now hates Sonic as a character, because the thing we learned the most about the movie, is that we hate everything about Sonic. So how does *this* become a plot twist? 

THEORY BELOW/POSSIBLE SPOILERS AHEAD

&gt;!Because you want Sonic dead. You want Sonic to die. You want him to fail. You want Robotnik to be the victor. But Sonic wins. Of course he wins. He destroys Dr. Robotnik's factory, the Doctor loses everything, Sonic is hailed as champion, blah blah blah, fade to black.!&lt;

&gt;!But wait. It's only been around 50 minutes in. We're only halfway through. What? How? Suddenly, we're back to the scene where Dr. Robotnik has Sonic surrounded on the building, presumably the final combat of that arc. Why this scene in particular? Because Dr. Robotnik is actually present for this combat, and wearing a rather interesting pair of goggles. Those goggles are also present in his wardrobe change at the end of the trailer. What if he were to crash sometime during this fight? What if there was a large fire, and a major portion of his unprotected face were to become burned and deformed? What if this fire completely burned his hair off, and frizzled his moustache? What if this was all a flashback, explaining Dr. Eggman's back story, and now both us the viewer and the character we're following have the same desires: to see Sonic destroyed. That's right: we are now following Dr. Eggman's story, and his quest for revenge. And we want him to win. He is now the protagonist, he looks like he should, and this movie is suddenly amazing.!&lt;",False,CrazyIdeas,"Sonic's design in the new movie is terrible on purpose, and will be the making of a great plot twist. (Possible spoilers hidden)",https://www.reddit.com/r/CrazyIdeas/comments/bjkh7h/sonics_design_in_the_new_movie_is_terrible_on/
514,Come0nBitch,t3_bjqj6v,1,/r/CrazyIdeas/comments/bjqj6v/imagine_a_cartoon_featuring_a_fictionalized/,2,,False,CrazyIdeas,"Imagine a cartoon featuring a fictionalized version of 6ix9ine as the villain; his appearance and a personality like himself but combined with Gru, Dr Doofenshmirtz and Waluigi",https://www.reddit.com/r/CrazyIdeas/comments/bjqj6v/imagine_a_cartoon_featuring_a_fictionalized/
515,symbiosa,t3_bjmdo1,0,/r/CrazyIdeas/comments/bjmdo1/become_a_world_famous_method_actor_just_so_you/,8,,False,CrazyIdeas,Become a world famous method actor just so you can murder someone and make an insanity defense,https://www.reddit.com/r/CrazyIdeas/comments/bjmdo1/become_a_world_famous_method_actor_just_so_you/
516,Tygo_S,t3_bjs3vl,0,/r/CrazyIdeas/comments/bjs3vl/harambe_are_an_groalla/,0,HaramBe gOt shOoT I sAd HE GroAlla,False,CrazyIdeas,Harambe arE aN GroaLla,https://www.reddit.com/r/CrazyIdeas/comments/bjs3vl/harambe_are_an_groalla/
517,[deleted],t3_bjo7ik,1,/r/CrazyIdeas/comments/bjo7ik/if_text_your_exes_day_was_an_annual_holiday_wed/,5,I propose May 4. Hmu.,False,CrazyIdeas,"If Text Your Exes Day was an annual holiday, we'd get rid of so much awkwardness",https://www.reddit.com/r/CrazyIdeas/comments/bjo7ik/if_text_your_exes_day_was_an_annual_holiday_wed/
518,Unlucky_Zone,t3_bjozvz,1,/r/CrazyIdeas/comments/bjozvz/create_an_isolated_country_just_for_antivaxxers/,3,"Survival of the fittest at its finest

&amp;#x200B;

Edit: would be an isolated island &amp; has a bubble like in the hunger games to prevent transmission from vectors",False,CrazyIdeas,Create an isolated country just for anti-vaxxers,https://www.reddit.com/r/CrazyIdeas/comments/bjozvz/create_an_isolated_country_just_for_antivaxxers/
519,LionEmpire,t3_bjeoc8,10,/r/CrazyIdeas/comments/bjeoc8/if_you_see_a_cross_post_then_upvote_the_original/,64,"I mean really. It’s not that hard. The credit should got to the person who make the joke, not the person who said it louder. I see tons of cross posts with more upvoted then the post they cross posted.",False,CrazyIdeas,"If you see a cross post, then upvote the original.",https://www.reddit.com/r/CrazyIdeas/comments/bjeoc8/if_you_see_a_cross_post_then_upvote_the_original/
520,TacoWarez,t3_bj20ul,140,/r/CrazyIdeas/comments/bj20ul/make_brake_lights_a_color_gradient_going_light_to/,3287,,False,CrazyIdeas,Make brake lights a color gradient going light to dark depending on how hard the brakes are pressed so you can tell if the person in front of you is lightly tapping their brakes or slamming on them.,https://www.reddit.com/r/CrazyIdeas/comments/bj20ul/make_brake_lights_a_color_gradient_going_light_to/
521,[deleted],t3_bjlk16,9,/r/CrazyIdeas/comments/bjlk16/a_subreddit_called_reddit_redeems_humanity_where/,7,Is it crazy to be altruistic? Maybe so. But like the good kind of crazy.,False,CrazyIdeas,A subreddit called Reddit redeems humanity where people post screenshots of really nice social interactions they see,https://www.reddit.com/r/CrazyIdeas/comments/bjlk16/a_subreddit_called_reddit_redeems_humanity_where/
522,stratdaddy3000,t3_bjpnl3,1,/r/CrazyIdeas/comments/bjpnl3/we_should_just_genetically_modify_trees_to_grow/,2,,False,CrazyIdeas,We should just genetically modify trees to grow faster to counteract climate change.,https://www.reddit.com/r/CrazyIdeas/comments/bjpnl3/we_should_just_genetically_modify_trees_to_grow/
523,tddies,t3_bjizmc,4,/r/CrazyIdeas/comments/bjizmc/using_dead_whales_as_a_weapon/,12,"Ok so this is crazy but imagine us somehow lifting a dead whale and airlifting it to wherever our enemies stay. Drop the dead whale on our enemies’ base, it’ll kill anyone it hits and dead whales explode after being dead for a while, so the rest of them will probably try to remove it but will inevitably be slapped and killed by an intestine when it explodes. I love whales and don’t wanna see them dead but if they do die we should put them to use",False,CrazyIdeas,Using dead whales as a weapon,https://www.reddit.com/r/CrazyIdeas/comments/bjizmc/using_dead_whales_as_a_weapon/
524,L8ter_Sk8er,t3_bjnjse,0,/r/CrazyIdeas/comments/bjnjse/schools_should_give_basic_therapudic_training_to/,3,,False,CrazyIdeas,Schools should give basic therapudic training to students so kids can talk to thier friends if they need it.,https://www.reddit.com/r/CrazyIdeas/comments/bjnjse/schools_should_give_basic_therapudic_training_to/
525,UncleBling,t3_bjnc3m,0,/r/CrazyIdeas/comments/bjnc3m/music_playback_eq_presets_should_include_a/,3,Especially for Aja!,False,CrazyIdeas,"Music Playback EQ presets should include a ""Classic Steely Dan"" setting.",https://www.reddit.com/r/CrazyIdeas/comments/bjnc3m/music_playback_eq_presets_should_include_a/
526,IAmYourDaydreamer,t3_bjeyfo,0,/r/CrazyIdeas/comments/bjeyfo/a_collar_for_dogs_and_babies_that_turns_their/,29,,False,CrazyIdeas,A collar for dogs and babies that turns their barks and screaming into robotic beeps like R2D2.,https://www.reddit.com/r/CrazyIdeas/comments/bjeyfo/a_collar_for_dogs_and_babies_that_turns_their/
527,SwimmingNaked,t3_bjc9j8,3,/r/CrazyIdeas/comments/bjc9j8/make_one_of_those_ghost_hunting_reality_shows_but/,97,,False,CrazyIdeas,"Make one of those ghost hunting ""reality"" shows, but from the point of view of the hoaxer, and make it a contest. The person who tricks the most people for the longest time wins!",https://www.reddit.com/r/CrazyIdeas/comments/bjc9j8/make_one_of_those_ghost_hunting_reality_shows_but/
528,oLjMa,t3_bjf9y5,2,/r/CrazyIdeas/comments/bjf9y5/there_needs_to_be_a_sort_social_media_rewind/,25,,False,CrazyIdeas,There needs to be a sort social media rewind button. Choose a date and time and your feed starts refreshing from there. If you’re binge watching a series for example and you want to here people’s opinions from 5 years ago... there you go.,https://www.reddit.com/r/CrazyIdeas/comments/bjf9y5/there_needs_to_be_a_sort_social_media_rewind/
529,FRENKI8,t3_bjqc7j,0,/r/CrazyIdeas/comments/bjqc7j/a_youtube_channel_that_makes_references_of_dark/,1,,False,CrazyIdeas,A Youtube channel that makes references of dark and twisted ARG but never does anything creepy or weird.,https://www.reddit.com/r/CrazyIdeas/comments/bjqc7j/a_youtube_channel_that_makes_references_of_dark/
530,SMB_trash,t3_bjo5lp,0,/r/CrazyIdeas/comments/bjo5lp/pistachease/,2,"A pistachio company that also makes products that enhance the pistachio eating experience

Some product ideas:
• A spring loaded wedge that one can pull back and release between pistachio shells so that you can actually crack open those shells that are super tough without breaking you finger nails in half.
• A bottle opener style wedge for the same purpose 
• This ones a bit of a stretch, but a machine that looks kind of like a gumball machine where when you crank the handle the pistachios fall into a mechanism which separates the shells and drops them down a chute that can be cleaned. What you have remaining is a ton of opened pistachio nuts and avoid a ton of work opening them.

I do understand you can just buy the pistachios without the shell but I feel like this would be a good marketing idea for a company like Wonderful.",False,CrazyIdeas,PistachEase,https://www.reddit.com/r/CrazyIdeas/comments/bjo5lp/pistachease/
531,ahtishamafzal,t3_bjq7a9,2,/r/CrazyIdeas/comments/bjq7a9/100_screen_to_body_ratio_smartphones_without_any/,0,"Go check out Samsung A80 camera function, now imagine it is smaller in size and it has screen on one side, cameras on other side and work as a modular screen just like samsung’s new modular Micro LEDs.  

Now make a hole in screen and place that moving camera/screen module as iPhone X notch.

Now it has modular screen which looks like a normal screen but when we open camera, it rotate to back side and show cameras. 

When we close camera, it rotate back to screen side and shows screen part again. 

It will solve these issues:
1. It will not have dust particles issues because it won’t have sliding mechanism. 
2. Phone case companies will make cases without any problem coz this whole setup will be inside phone. Phone will look like a normal mobile. 
3. We can have full screen phones without Notch. 

Note: if you like this idea, please upvote it. I have sent this to so many smartphone companies, blogs with diagrams and images but nobody responded. 
Thanks.",False,CrazyIdeas,100% screen to body ratio smartphones without any Notch.,https://www.reddit.com/r/CrazyIdeas/comments/bjq7a9/100_screen_to_body_ratio_smartphones_without_any/
