,author,name,num_comments,permalink,score,selftext,stickied,subreddit,title,url
0,AddictedReddit,t3_854s2f,33,/r/CrazyIdeas/comments/854s2f/folks_be_sure_to_read_the_sidebar_especially_rule/,212,"This whole subreddit is becoming a politics circlejerk. Some of you may not see it, because we often catch submits before they gain traction. And sometimes the ""borderline"" ones are allowed to slip through if the commentary isn't out of control. 

The rules on politics will be more heavily enforced, **repeat Rule 4 and Rule 6 offenders are going to start getting bans**. This goes for both sides! 90% of Reddit is a politics circlejerk, you can get your fix for that somewhere else. ",True,CrazyIdeas,"Folks, be sure to read the sidebar. Especially rule 4.",https://www.reddit.com/r/CrazyIdeas/comments/854s2f/folks_be_sure_to_read_the_sidebar_especially_rule/
1,aiken_,t3_bm4krt,53,/r/CrazyIdeas/comments/bm4krt/an_international_registry_where_you_can_indicate/,2090,,False,CrazyIdeas,An international registry where you can indicate your mother is dead so you don’t get bombarded with mother’s day marketing emails,https://www.reddit.com/r/CrazyIdeas/comments/bm4krt/an_international_registry_where_you_can_indicate/
2,LogicalOptimist,t3_blqytz,85,/r/CrazyIdeas/comments/blqytz/when_your_online_order_is_a_few_dollars_short_of/,2795,"Often I find myself a few dollars short of free shipping with nothing else I want to add to my cart. Sometimes I waste a ton of time attemping to find anything I could deem useful and many of these times I just abandoned an order because of it. What if instead when you found yourself short of the free shipping mark you could donate the rest to charity. Sure the companys might make a little less on individual orders occasionally but I can say from my personal experience those orders may have never been placed to begin with.

(Edit) As a daily reddit lurker I have to say I'm absolutely blown away at how much traction one of my posts received. I understand company's have shipping costs and profit margins to maintain so definitely not expecting anyone with corporate influence to get behind this crazy idea.    It's up to the average person like us to make the world better no matter how small of a contribution. It would be nice if it were easier to do so throughout the course of our normal day. A user mentioned change roundups at some places that let you donate your change to the nearest dollar. I hope those places let you pick where you donate as some nonprofits have ridiculously overpaid ceo's and overly extravagant office spaces and that can't be the answer. I'm just a blue collar worker with poor grammer skills and to much faith in society so take my thoughts with a grain of salt I suppose. Thank's to everyone for checking out my post!",False,CrazyIdeas,When your online order is a few dollars short of free shipping you had the option to donate the difference to charity.,https://www.reddit.com/r/CrazyIdeas/comments/blqytz/when_your_online_order_is_a_few_dollars_short_of/
3,ImOwningThisUsername,t3_bm7tyt,2,/r/CrazyIdeas/comments/bm7tyt/mobilize_all_the_influence_of_reddit_to_find_the/,10,"We could then convince him to either be active again or give his account. For example, it could be given to a respected memelord of Reddit.

&amp;#x200B;

Do not waste an account with such great potential. Reddit Assemble.",False,CrazyIdeas,Mobilize all the influence of Reddit to find the owner of the account u/noobmaster69,https://www.reddit.com/r/CrazyIdeas/comments/bm7tyt/mobilize_all_the_influence_of_reddit_to_find_the/
4,LoneKharnivore,t3_bm4g66,2,/r/CrazyIdeas/comments/bm4g66/profilespecific_filters_for_youtube_so_i_never/,24,Or whatever.,False,CrazyIdeas,Profile-specific filters for YouTube so I never have to see ancient aliens or reaction videos again...,https://www.reddit.com/r/CrazyIdeas/comments/bm4g66/profilespecific_filters_for_youtube_so_i_never/
5,SausageGobbler69,t3_bma8p3,0,/r/CrazyIdeas/comments/bma8p3/there_should_be_an_option_to_turn_off_the/,5,,False,CrazyIdeas,There should be an option to turn off the atrocious music companies play when you’re on hold,https://www.reddit.com/r/CrazyIdeas/comments/bma8p3/there_should_be_an_option_to_turn_off_the/
6,iOwnAtheists,t3_bm688e,0,/r/CrazyIdeas/comments/bm688e/apple_should_release_a_camera_called_the_image/,9,,False,CrazyIdeas,Apple should release a camera called the iMage,https://www.reddit.com/r/CrazyIdeas/comments/bm688e/apple_should_release_a_camera_called_the_image/
7,NickStuHall,t3_bm836c,1,/r/CrazyIdeas/comments/bm836c/toilets_that_weigh_how_much_you_just_pooped/,5,,False,CrazyIdeas,Toilets that weigh how much you just pooped.,https://www.reddit.com/r/CrazyIdeas/comments/bm836c/toilets_that_weigh_how_much_you_just_pooped/
8,chickenbooty123,t3_bmcdu6,0,/r/CrazyIdeas/comments/bmcdu6/this_might_be_really_stupid_but_if_people_brought/,2,,False,CrazyIdeas,"This might be really stupid but if people brought potted plants to the moon, could they create an atmosphere of some sort as a result of the oxygen the plants would “exhale” and the carbon dioxide that we exhale?",https://www.reddit.com/r/CrazyIdeas/comments/bmcdu6/this_might_be_really_stupid_but_if_people_brought/
9,WeakSauceRevolver,t3_bm2got,1,/r/CrazyIdeas/comments/bm2got/there_should_be_a_club_like_toastmasters_but/,34,,False,CrazyIdeas,"There should be a club like Toastmasters, but instead of learning public speaking, I learn to do better at keeping my mouth shut.",https://www.reddit.com/r/CrazyIdeas/comments/bm2got/there_should_be_a_club_like_toastmasters_but/
10,Bank_Gothic,t3_bm7ros,1,/r/CrazyIdeas/comments/bm7ros/put_hotpockets_cook_times_on_the_cooking_sleeves/,6,,False,CrazyIdeas,"Put Hotpockets' cook times on the cooking sleeves, not just the box, so I don't have to fish the fucking thing back out of the trash every time.",https://www.reddit.com/r/CrazyIdeas/comments/bm7ros/put_hotpockets_cook_times_on_the_cooking_sleeves/
11,deleted_acc0unt,t3_bmc4gi,0,/r/CrazyIdeas/comments/bmc4gi/nonprofits_should_use_the_money_saved_for_not/,2,,False,CrazyIdeas,"Nonprofits should use the money saved for not having to file taxes to buy debt for pennies on the dollar, and then never collect on the debt.",https://www.reddit.com/r/CrazyIdeas/comments/bmc4gi/nonprofits_should_use_the_money_saved_for_not/
12,mikeroo_,t3_bm5q65,0,/r/CrazyIdeas/comments/bm5q65/wet_dreams_should_be_called_nutmares/,7,,False,CrazyIdeas,Wet dreams should be called “nutmares”,https://www.reddit.com/r/CrazyIdeas/comments/bm5q65/wet_dreams_should_be_called_nutmares/
13,Ghosttwo,t3_bm9j5n,1,/r/CrazyIdeas/comments/bm9j5n/drive_terribly_slow_on_a_onelane_road_and_become/,3,,False,CrazyIdeas,Drive terribly slow on a one-lane road and become the merry conductor of your own parade of cars!,https://www.reddit.com/r/CrazyIdeas/comments/bm9j5n/drive_terribly_slow_on_a_onelane_road_and_become/
14,fuzzyblackyeti,t3_bm8bwm,3,/r/CrazyIdeas/comments/bm8bwm/a_built_in_garbage_disposal_type_attachment_on/,5,,False,CrazyIdeas,A built in garbage disposal type attachment on toilets that will shred your shit when you flush the toilet to prevent clogs,https://www.reddit.com/r/CrazyIdeas/comments/bm8bwm/a_built_in_garbage_disposal_type_attachment_on/
15,mattrydell,t3_bm4zmz,6,/r/CrazyIdeas/comments/bm4zmz/a_pollen_vaccination/,7,,False,CrazyIdeas,A pollen vaccination.,https://www.reddit.com/r/CrazyIdeas/comments/bm4zmz/a_pollen_vaccination/
16,gct,t3_bm94g9,5,/r/CrazyIdeas/comments/bm94g9/lets_get_jennifer_lawrence_to_run_against_mitch/,4,"Love it or hate it, fame can get you elected.  She'll be just over the age limit, she's a native Kentuckian and could absolutely wipe the floor with him, giving the country a much needed enema.",False,CrazyIdeas,Let's get Jennifer Lawrence to run against Mitch McConnell in 2020,https://www.reddit.com/r/CrazyIdeas/comments/bm94g9/lets_get_jennifer_lawrence_to_run_against_mitch/
17,DiscoFish420,t3_bm638q,3,/r/CrazyIdeas/comments/bm638q/attach_your_illegal_drugs_to_a_drone_on_your_car/,6,,False,CrazyIdeas,"Attach your illegal drugs to a drone on your car roof. If the police stops you, fly the drugs away with your drone before they catch you.",https://www.reddit.com/r/CrazyIdeas/comments/bm638q/attach_your_illegal_drugs_to_a_drone_on_your_car/
18,Mutant_Llama1,t3_bma1sv,0,/r/CrazyIdeas/comments/bma1sv/a_plugin_that_replaces_the_name_of_any_endgame/,2,,False,CrazyIdeas,"A plugin that replaces the name of any endgame character with a random other one, to obscure spoilers.",https://www.reddit.com/r/CrazyIdeas/comments/bma1sv/a_plugin_that_replaces_the_name_of_any_endgame/
19,showerswithrazors,t3_bmcp0k,0,/r/CrazyIdeas/comments/bmcp0k/install_fake_grass_so_you_dont_have_to_hear_lawn/,1,"Especially at apartment complexes where there is so much grass there is pretty much someone mowing the lawn all day every day.

Grass that isn’t used much or at all then doesn’t have to have noisy maintenance.",False,CrazyIdeas,Install fake grass so you don’t have to hear lawn mowers.,https://www.reddit.com/r/CrazyIdeas/comments/bmcp0k/install_fake_grass_so_you_dont_have_to_hear_lawn/
20,TheyCallMeDrAsshole,t3_bmcoez,0,/r/CrazyIdeas/comments/bmcoez/get_a_lightsaber_with_a_longer_handle_and_harness/,0,,False,CrazyIdeas,Get a lightsaber with a longer handle and harness the power of The Torque,https://www.reddit.com/r/CrazyIdeas/comments/bmcoez/get_a_lightsaber_with_a_longer_handle_and_harness/
21,Jelsen,t3_bmcl8u,0,/r/CrazyIdeas/comments/bmcl8u/posting_something_expected_on_runexpected/,1,Because surfing that sub your expecting the unexpected so the expected is unexpected unless your expecting the expected in which case the unexpected is unexpected,False,CrazyIdeas,Posting something expected on r/unexpected,https://www.reddit.com/r/CrazyIdeas/comments/bmcl8u/posting_something_expected_on_runexpected/
22,haringtiti,t3_bm3nld,4,/r/CrazyIdeas/comments/bm3nld/toothpaste_that_doesnt_make_everything_taste/,10,,False,CrazyIdeas,Toothpaste that doesn't make everything taste terrible after you use it.,https://www.reddit.com/r/CrazyIdeas/comments/bm3nld/toothpaste_that_doesnt_make_everything_taste/
23,Dr_Eastman,t3_bm9ik4,0,/r/CrazyIdeas/comments/bm9ik4/chocolate_buttermilk/,2,,False,CrazyIdeas,Chocolate Buttermilk,https://www.reddit.com/r/CrazyIdeas/comments/bm9ik4/chocolate_buttermilk/
24,flopsyplum,t3_bm7oth,1,/r/CrazyIdeas/comments/bm7oth/one_weird_trick_ads_should_be_banned/,3,,False,CrazyIdeas,“One Weird Trick” ads should be banned,https://www.reddit.com/r/CrazyIdeas/comments/bm7oth/one_weird_trick_ads_should_be_banned/
25,Cawwten,t3_bm9b7w,0,/r/CrazyIdeas/comments/bm9b7w/ice_cream_train/,2,Like Ice cream trucks but train cars that use the existing railways to go town to town and sell ice cream at train stations.,False,CrazyIdeas,Ice Cream Train,https://www.reddit.com/r/CrazyIdeas/comments/bm9b7w/ice_cream_train/
26,eyeh8,t3_bmbz8b,0,/r/CrazyIdeas/comments/bmbz8b/for_the_2020_presidential_election_run_as_a/,0,,False,CrazyIdeas,For the 2020 presidential election run as a republican using the slogan Make Republicans American Again.,https://www.reddit.com/r/CrazyIdeas/comments/bmbz8b/for_the_2020_presidential_election_run_as_a/
27,HuskyPants,t3_bm3fm0,1,/r/CrazyIdeas/comments/bm3fm0/augmented_car_karma_where_you_can_see_karma/,9,,False,CrazyIdeas,Augmented Car Karma where you can see Karma rating of the car trying to merge in front of you,https://www.reddit.com/r/CrazyIdeas/comments/bm3fm0/augmented_car_karma_where_you_can_see_karma/
28,Fufa120,t3_bm8zig,0,/r/CrazyIdeas/comments/bm8zig/an_iphone_power_sharing_cable/,2,Basically phone jumper cables,False,CrazyIdeas,An iPhone power sharing cable,https://www.reddit.com/r/CrazyIdeas/comments/bm8zig/an_iphone_power_sharing_cable/
29,th0t_exterminator69,t3_bmbgxh,0,/r/CrazyIdeas/comments/bmbgxh/whichever_state_wins_the_state_of_origin_becomes/,1,,False,CrazyIdeas,Whichever state wins the State Of Origin becomes Australian Capitol Territory,https://www.reddit.com/r/CrazyIdeas/comments/bmbgxh/whichever_state_wins_the_state_of_origin_becomes/
30,Melssenator,t3_bm55r9,13,/r/CrazyIdeas/comments/bm55r9/pay_people_to_recycle_so_less_people_throw_away/,6,"If places are actually serious on improving the environment, I don’t know why this isn’t already a thing. So much of the trash in landfills and on the streets are thugs that can actually be recycled. This would promote businesses and people alike to recycle way more. It wouldn’t even have to be that much.",False,CrazyIdeas,Pay people to recycle so less people throw away plastics,https://www.reddit.com/r/CrazyIdeas/comments/bm55r9/pay_people_to_recycle_so_less_people_throw_away/
31,ekolis,t3_bm5v7e,1,/r/CrazyIdeas/comments/bm5v7e/if_we_stopped_catering_to_the_needs_of_people/,3,,False,CrazyIdeas,"If we stopped catering to the needs of people with allergies, they would all die off and we'd never have worry about allergies again.",https://www.reddit.com/r/CrazyIdeas/comments/bm5v7e/if_we_stopped_catering_to_the_needs_of_people/
32,EpicMan604,t3_bm5v5z,2,/r/CrazyIdeas/comments/bm5v5z/a_post_that_acts_as_a_subreddit_the_comments_act/,4,,False,CrazyIdeas,"A post that acts as a subreddit: the comments act as posts. To join, simply save the post. Upvote good subreddits, downvote bad ones. Should I make a subreddit for this? What should it be called?",https://www.reddit.com/r/CrazyIdeas/comments/bm5v5z/a_post_that_acts_as_a_subreddit_the_comments_act/
33,Sillsy93,t3_bmb9vo,2,/r/CrazyIdeas/comments/bmb9vo/moving_the_upvote_button_to_the_other_side_im_to/,1,,False,CrazyIdeas,Moving the upvote button to the other side!. I'm to lazy for this shit!,https://www.reddit.com/r/CrazyIdeas/comments/bmb9vo/moving_the_upvote_button_to_the_other_side_im_to/
34,flappyseahorse5,t3_bmb5o8,3,/r/CrazyIdeas/comments/bmb5o8/a_job_ran_by_billionaires_where_people_come_in/,0,,False,CrazyIdeas,A job ran by billionaires where people come in and play video games to get paid per hour for playing them.,https://www.reddit.com/r/CrazyIdeas/comments/bmb5o8/a_job_ran_by_billionaires_where_people_come_in/
35,rfd2115,t3_bmb4ic,1,/r/CrazyIdeas/comments/bmb4ic/toilet_interior_with_fur_so_that_it_does_not/,1,,False,CrazyIdeas,Toilet interior with fur so that it does not resonate when you fart.,https://www.reddit.com/r/CrazyIdeas/comments/bmb4ic/toilet_interior_with_fur_so_that_it_does_not/
36,AnalKevlar,t3_bmb306,0,/r/CrazyIdeas/comments/bmb306/add_pressurized_air_to_the_middle_of_bullets_so/,1,,False,CrazyIdeas,Add pressurized air to the middle of bullets so that when they impact they explode with more force like an over pressurized pressure cooker.,https://www.reddit.com/r/CrazyIdeas/comments/bmb306/add_pressurized_air_to_the_middle_of_bullets_so/
37,dIB59,t3_bmaqno,0,/r/CrazyIdeas/comments/bmaqno/rather_than_1star_reviews_why_not_mark_5star/,0,"So, I was unable to post a review on their app for no apparent reason so I marked most of their 5-year reviews as spam.

If we can't increase our offense; decrease their defense instead.",False,CrazyIdeas,Rather than 1-star reviews why not mark 5-star reviews as spam.,https://www.reddit.com/r/CrazyIdeas/comments/bmaqno/rather_than_1star_reviews_why_not_mark_5star/
38,komostase,t3_bmaocg,0,/r/CrazyIdeas/comments/bmaocg/phone_companies_should_have_a_second_password/,1,,False,CrazyIdeas,"Phone companies should have a “second password” feature. When typed in, it instantly alerts authorities of your location. Used when kidnapped and allowed to use phone, but doesn’t raise suspicion of making a phone call.",https://www.reddit.com/r/CrazyIdeas/comments/bmaocg/phone_companies_should_have_a_second_password/
39,ILoveTaterTits,t3_bmagsw,0,/r/CrazyIdeas/comments/bmagsw/reddit_should_have_its_own_met_gala_where/,1,,False,CrazyIdeas,"Reddit should have its own Met Gala, where redditors post themselves in their own ridiculous creative outfits.",https://www.reddit.com/r/CrazyIdeas/comments/bmagsw/reddit_should_have_its_own_met_gala_where/
40,NoBlueNatzys,t3_bmafly,0,/r/CrazyIdeas/comments/bmafly/make_a_co2_collector_that_separates_the_carbon/,1,,False,CrazyIdeas,Make a CO2 collector that separates the carbon and turns it into diamonds.,https://www.reddit.com/r/CrazyIdeas/comments/bmafly/make_a_co2_collector_that_separates_the_carbon/
41,Kaje26,t3_bm7ljb,1,/r/CrazyIdeas/comments/bm7ljb/what_if_there_was_a_president_of_the_united/,2,,False,CrazyIdeas,What if there was a President of the United States with the last name of “America”. So he would be “President America”.,https://www.reddit.com/r/CrazyIdeas/comments/bm7ljb/what_if_there_was_a_president_of_the_united/
42,OmniINTJ,t3_bmae7t,3,/r/CrazyIdeas/comments/bmae7t/auto_manufacturers_should_list_their_cost_to/,1,The cost of vehicles these days is absurd. I for one would like to see how much they actually make.,False,CrazyIdeas,Auto manufacturers should list their cost to manufacture and profit on the window sticker.,https://www.reddit.com/r/CrazyIdeas/comments/bmae7t/auto_manufacturers_should_list_their_cost_to/
43,Heybroletsparty,t3_bm9owh,0,/r/CrazyIdeas/comments/bm9owh/enlist_the_rock_to_remove_trump_from_office_via/,1,"At this point, fight fire with fire.",False,CrazyIdeas,Enlist “The Rock” to remove Trump from office via the People’s elbow,https://www.reddit.com/r/CrazyIdeas/comments/bm9owh/enlist_the_rock_to_remove_trump_from_office_via/
44,Jtegg007,t3_bm9nsh,2,/r/CrazyIdeas/comments/bm9nsh/a_new_keyboard_key_select_it_would_cycle_through/,1,"God this would make my menial typing tasks and copy/paste tasks so much more efficient. Why should I drag and drop across ""motorcycle"" to type ""bike"" when a single button tap could handle it; and then I get pissed when I accidentally highlight ""otorcycle"" and have to left arrow 4 times to backspace that errant ""m""!",False,CrazyIdeas,"A new keyboard key: Select. It would cycle through 4 selections; Select word (under the cursor), Select sentence, Select all, Select none.",https://www.reddit.com/r/CrazyIdeas/comments/bm9nsh/a_new_keyboard_key_select_it_would_cycle_through/
45,Boronthemoron,t3_bm4bng,4,/r/CrazyIdeas/comments/bm4bng/assign_new_symbols_for_0_1_2_5_9_so_that_they/,5,,False,CrazyIdeas,"Assign new symbols for 0, 1, 2, 5, 9 so that they don't get confused with letters. Huge undertaking, I know, but it could potentially prevent accidents and save lives.",https://www.reddit.com/r/CrazyIdeas/comments/bm4bng/assign_new_symbols_for_0_1_2_5_9_so_that_they/
46,ThePugalo,t3_bm57cv,7,/r/CrazyIdeas/comments/bm57cv/with_all_of_these_new_aibased_cars_there_should/,3,"If you try to change lanes without using your blinker, then the AI will assume the car is drifting and will *forcibly* correct the car.",False,CrazyIdeas,"With all of these new AI-based cars, there should be a mechanism that doesn't allow you to change lanes without using your blinker.",https://www.reddit.com/r/CrazyIdeas/comments/bm57cv/with_all_of_these_new_aibased_cars_there_should/
47,illuminati-CRAZ,t3_bm9hde,0,/r/CrazyIdeas/comments/bm9hde/make_everybody_in_the_world_learn_how_to_convert/,1,,False,CrazyIdeas,Make everybody in the world learn how to convert their local time to UTC. Then make them use UTC when talking across time zones in 24-hour format. When using local time use 12-hour format.,https://www.reddit.com/r/CrazyIdeas/comments/bm9hde/make_everybody_in_the_world_learn_how_to_convert/
48,justBarcley,t3_bm9e7n,0,/r/CrazyIdeas/comments/bm9e7n/a_reality_tv_show_which_low_key_explains_politics/,1,,False,CrazyIdeas,A reality TV show which low key explains politics and government systems to people who watch it.,https://www.reddit.com/r/CrazyIdeas/comments/bm9e7n/a_reality_tv_show_which_low_key_explains_politics/
49,TuvoksDoRag,t3_bm9443,0,/r/CrazyIdeas/comments/bm9443/the_mcu_should_put_out_a_short_documentary_all/,1,,False,CrazyIdeas,"The MCU should put out a short ""documentary"" all about the aftermath The Snap.",https://www.reddit.com/r/CrazyIdeas/comments/bm9443/the_mcu_should_put_out_a_short_documentary_all/
50,DirtyShelf,t3_bm91i3,2,/r/CrazyIdeas/comments/bm91i3/schools_should_offer_martial_arts_classes_and/,1,"No more school fights, self defense education, and the school gets hella money from the tournament entry tickets.",False,CrazyIdeas,Schools should offer martial arts classes and host tournaments where students can settle beef.,https://www.reddit.com/r/CrazyIdeas/comments/bm91i3/schools_should_offer_martial_arts_classes_and/
51,lumpycomforter,t3_bm4pyo,2,/r/CrazyIdeas/comments/bm4pyo/an_app_that_mimics_uber_eats_where_you_place_your/,3,,False,CrazyIdeas,An app that mimics uber eats where you place your order but instead of actually ordering the food it just moves the total to your saving account,https://www.reddit.com/r/CrazyIdeas/comments/bm4pyo/an_app_that_mimics_uber_eats_where_you_place_your/
52,gct,t3_bm8g4x,0,/r/CrazyIdeas/comments/bm8g4x/can_we_get_jennifer_lawrence_to_run_against_mitch/,1,"I'm firmly in the fame != electable camp, but she's a Kentucky native and could easily defeat him on her name alone.  She'll be 30 on August 15, 2020 as well, sneaking her in just above the age limit.  He doesn't have a Democratic challenger yet and this would break his stranglehold on the country.  She doesn't even have to do the job, just getting him out of the way would be enough.",False,CrazyIdeas,Can we get Jennifer Lawrence to run against Mitch McConnell in 2020?,https://www.reddit.com/r/CrazyIdeas/comments/bm8g4x/can_we_get_jennifer_lawrence_to_run_against_mitch/
53,Wholsum,t3_bm5iw3,1,/r/CrazyIdeas/comments/bm5iw3/for_oneday_twitter_unlocks_all_the_locked/,2,,False,CrazyIdeas,For one-day twitter unlocks all the locked accounts &amp; lays their posts bare for the scrutiny of the Public. cyber-purge.,https://www.reddit.com/r/CrazyIdeas/comments/bm5iw3/for_oneday_twitter_unlocks_all_the_locked/
54,bobmichal,t3_bm53yu,0,/r/CrazyIdeas/comments/bm53yu/play_the_default_androidiphone_alarm_tone_in_a/,2,,False,CrazyIdeas,Play the default Android/iPhone alarm tone in a horror film to drive audiences into madness,https://www.reddit.com/r/CrazyIdeas/comments/bm53yu/play_the_default_androidiphone_alarm_tone_in_a/
55,Gently_Farting,t3_bm6txd,1,/r/CrazyIdeas/comments/bm6txd/robert_mueller_should_release_his_report_to_the/,0,,False,CrazyIdeas,Robert Mueller should release his report to the public,https://www.reddit.com/r/CrazyIdeas/comments/bm6txd/robert_mueller_should_release_his_report_to_the/
56,revoman,t3_bm6tpu,0,/r/CrazyIdeas/comments/bm6tpu/auto_moderated_comments_should_not_show_up_as_a/,1,,False,CrazyIdeas,Auto moderated comments should not show up as a comment on the main page.,https://www.reddit.com/r/CrazyIdeas/comments/bm6tpu/auto_moderated_comments_should_not_show_up_as_a/
57,SuicideSkirmish,t3_bm375i,1,/r/CrazyIdeas/comments/bm375i/dont_peddle_the_idea_of_forgiveness_in/,2,This enables negative behaviors. If you get dumped and stay dumped you’ll be a better person with your next partner.,False,CrazyIdeas,Don’t peddle the idea of “forgiveness” in relationships.,https://www.reddit.com/r/CrazyIdeas/comments/bm375i/dont_peddle_the_idea_of_forgiveness_in/
58,rimjobjesus,t3_bm6hpe,0,/r/CrazyIdeas/comments/bm6hpe/instead_of_saying_mmmhmm_over_and_over_when/,1,"Instead of saying Mmmhmm mmhmmm mmhmm, make a chirping noise instead or say ""Teehee!"" Or ""Walrus penis"" And change the sound and phrase each time. Also this would help the talker know how fucking boring they are and hopefully get them to STFU.",False,CrazyIdeas,"Instead of saying ""Mmmhmm"" over and over when people are talking and boring you, you should use different fun phrases and sounds to liven up the conversation.",https://www.reddit.com/r/CrazyIdeas/comments/bm6hpe/instead_of_saying_mmmhmm_over_and_over_when/
59,kamran_is_talking,t3_bm6hdm,0,/r/CrazyIdeas/comments/bm6hdm/jennifer_melfi_makes_a_guest_entrance_in_the/,1,Recover from illness with her advice!,False,CrazyIdeas,Jennifer Melfi makes a guest entrance in the Final Game of Thrones! (Season 8),https://www.reddit.com/r/CrazyIdeas/comments/bm6hdm/jennifer_melfi_makes_a_guest_entrance_in_the/
60,derf_vader,t3_blv1sx,6,/r/CrazyIdeas/comments/blv1sx/only_send_little_people_into_space_so_if_they/,36,,False,CrazyIdeas,"Only send little people into space, so if they encounter hostile aliens they will underestimate the rest of us.",https://www.reddit.com/r/CrazyIdeas/comments/blv1sx/only_send_little_people_into_space_so_if_they/
61,DestroyAllClarinets,t3_bm0efc,0,/r/CrazyIdeas/comments/bm0efc/it_would_work/,9,,False,CrazyIdeas,It would work,https://www.reddit.com/r/Showerthoughts/comments/blul35/if_keyboards_had_braille_signs_on_them_we_would/
62,sirblastalot,t3_bm15nv,0,/r/CrazyIdeas/comments/bm15nv/a_hotel_where_every_room_is_bathed_in_hard/,4,,False,CrazyIdeas,"A hotel where every room is bathed in hard radiation between guests, to insure it's entirely sterile for the next visitor. As a bonus, ensures people check out on time.",https://www.reddit.com/r/CrazyIdeas/comments/bm15nv/a_hotel_where_every_room_is_bathed_in_hard/
63,Sirmutswa,t3_bm5sdj,2,/r/CrazyIdeas/comments/bm5sdj/a_dating_app_with_an_algorithm_that_only_allows/,1,,False,CrazyIdeas,A dating app with an algorithm that only allows unedited/unfiltered photos.,https://www.reddit.com/r/CrazyIdeas/comments/bm5sdj/a_dating_app_with_an_algorithm_that_only_allows/
64,SubjectsNotObjects,t3_bm2lyu,4,/r/CrazyIdeas/comments/bm2lyu/feed_lsd_to_all_the_pigeons_birds_and_wildlife_in/,2,,False,CrazyIdeas,"Feed LSD to all the pigeons, birds and wildlife in a city The Pope is visiting: trick every one into thinking some weird miracle has occurred.",https://www.reddit.com/r/CrazyIdeas/comments/bm2lyu/feed_lsd_to_all_the_pigeons_birds_and_wildlife_in/
