,author,name,num_comments,permalink,score,selftext,stickied,subreddit,title,url
771,EyeofEnder,t3_bi41ub,2,/r/CrazyIdeas/comments/bi41ub/screw_pills_capsules_and_syrups_in_brown_bottles/,15,,False,CrazyIdeas,"Screw pills, capsules and syrups in brown bottles. Start selling medicine dissolved in dyed water/other liquid and sell them in glass flasks and bottles like RPG potions.",https://www.reddit.com/r/CrazyIdeas/comments/bi41ub/screw_pills_capsules_and_syrups_in_brown_bottles/
772,derf_vader,t3_bi5jp1,4,/r/CrazyIdeas/comments/bi5jp1/feed_chickens_nothing_but_hot_peppers_so_their/,9,,False,CrazyIdeas,Feed chickens nothing but hot peppers so their wings are naturally spicy.,https://www.reddit.com/r/CrazyIdeas/comments/bi5jp1/feed_chickens_nothing_but_hot_peppers_so_their/
773,JC2808,t3_bi925g,3,/r/CrazyIdeas/comments/bi925g/tax_on_carbon/,2,The government should start putting a cap on the maximum amount of carbon that companies are allowed to emmit. If they go over this cap then they should have to pay a fine. Governments should start with a fairly high cap and gradually lower it. California did this exact thing and they have lowered their carbon footprint by a lot!,False,CrazyIdeas,Tax on carbon,https://www.reddit.com/r/CrazyIdeas/comments/bi925g/tax_on_carbon/
774,RubyTuxxe,t3_bi5fov,4,/r/CrazyIdeas/comments/bi5fov/what_if_our_teeth_were_flaccid_until_we_became/,10,,False,CrazyIdeas,What if our teeth were flaccid until we became hungry?,https://www.reddit.com/r/CrazyIdeas/comments/bi5fov/what_if_our_teeth_were_flaccid_until_we_became/
775,PLUMBUM2,t3_bi6qub,4,/r/CrazyIdeas/comments/bi6qub/hire_unemployed_actors_to_work_around_a/,4,,False,CrazyIdeas,Hire unemployed actors to work around a neighborhood looking nasty just to get property value down before buying a home there,https://www.reddit.com/r/CrazyIdeas/comments/bi6qub/hire_unemployed_actors_to_work_around_a/
776,CricketMeson,t3_bi6407,0,/r/CrazyIdeas/comments/bi6407/avengers_infinity_war_but_the_infinity_stones/,5,,False,CrazyIdeas,Avengers Infinity War but the infinity stones control the laws of thermodynamics.,https://www.reddit.com/r/CrazyIdeas/comments/bi6407/avengers_infinity_war_but_the_infinity_stones/
777,boobonic-blague,t3_bi3ha0,2,/r/CrazyIdeas/comments/bi3ha0/motorcycle_gangs_should_wield_scimitars_because/,12,,False,CrazyIdeas,"Motorcycle gangs should wield scimitars because the curved, lightweight blade is good for slashing attacks while riding",https://www.reddit.com/r/CrazyIdeas/comments/bi3ha0/motorcycle_gangs_should_wield_scimitars_because/
778,ultranothing,t3_bi5ntv,5,/r/CrazyIdeas/comments/bi5ntv/a_video_game_which_progresses_from_atari/,5,"A video game that has the same sort of effect as The Wizard Of Oz, which introduced people to colorization back in the 1930's by transitioning within the movie.

The Half-Life series were revolutionary, groundbreaking games. It's probably why there might never be a Half Life 3, because the market is so saturated with incredible FPS games that at this point it would be difficult to really stand out and evoke that same sort of reaction. There's been a legendary hype around HL3 for so long that it could only be a disappointment.

Unless, of course, it wasn't. If HL3 was a game unlike anything anyone had ever seen before. Use your imagination to create the perfect HL3. Visually stunning. Like, you want to cry, kind of thing. A true work of art. 

Tie it in to the advances of human technology. You're playing Atari 2600, we work our way through the years, every scene from every era of every game is tying into this story that's being weaved through. The suspense is nearly killing us! And then, Dorothy lands in Oz and opens that door.",False,CrazyIdeas,"A video game which progresses from Atari 2600-style graphics, to the 8-bit era, though Sega Genesis and SNES, all the way through to the modern day.",https://www.reddit.com/r/CrazyIdeas/comments/bi5ntv/a_video_game_which_progresses_from_atari/
779,thegimboid,t3_bi7b7g,1,/r/CrazyIdeas/comments/bi7b7g/a_film_set_in_ancient_times_about_a_girl_who/,3,"Eventually it turns out to be a prequel to Monsters Inc/Monsters University, which shows the monsters disappearing into their alternate universe to avoid the humans.  
The fear of children could also be explained by having a monster contract an illness from a sick child.",False,CrazyIdeas,A film set in ancient times about a girl who makes friends with a peculiar monster.,https://www.reddit.com/r/CrazyIdeas/comments/bi7b7g/a_film_set_in_ancient_times_about_a_girl_who/
780,WaffleCat3367,t3_bi9o5w,0,/r/CrazyIdeas/comments/bi9o5w/a_new_game_watch_game_for_the_nintendo_switch/,1,"A 2D puzzle sidescroller where you play as Mr. Game and Watch. He moves around like he does in Smash Bros.

In case you don't understand what I mean, imagine Pac-Man 2: The New Adventures, except with direct control over Pac-Man.

The game is set in Flat Zone, a big, expansive world featuring the landmarks from all the Game &amp; Watch games (like the gas station from Oil Panic, the farm from Egg, the fort from Fire Attack, ect). 

The story of the game is simple. It starts with Mr. Game &amp; Watch doing mundane tasks, and it seems like that's all there is. But later in the game, it gets more intense, ending with a battle between Mr. Game &amp; Watch and the giant octopus.

A fun mechanic could be that you play Game &amp; Watch games to solve problems. For example, a bridge is broken, and someone asks you to temporarily fix it by using a manhole cover. Then you have to play the Manhole Game &amp; Watch game.

Once you beat one of those Game &amp; Watch minigames, you unlock the ability to play as the protagonist from that game. So if you beat Manhole, you get to play as the guy from Manhole instead of Mr. Game &amp; Watch. It's just for looks, though.

This game also has every Game &amp; Watch game included in it. Go to Mr. Game &amp; Watch's house and you can play the ones you've unlocked. You unlock Game &amp; Watch games by playing through the story. (like how the original Animal Crossing had NES games). However, unlike Game &amp; Watch Gallery, this game doesn't have modern mode.",False,CrazyIdeas,A new Game &amp; Watch game for the Nintendo Switch,https://www.reddit.com/r/CrazyIdeas/comments/bi9o5w/a_new_game_watch_game_for_the_nintendo_switch/
781,Yomika7,t3_bhz5kl,4,/r/CrazyIdeas/comments/bhz5kl/porn_sites_should_enable_sorting_by_the_number_of/,40,,False,CrazyIdeas,Porn sites should enable sorting by the number of people who leave after watching the video,https://www.reddit.com/r/CrazyIdeas/comments/bhz5kl/porn_sites_should_enable_sorting_by_the_number_of/
782,isananimal,t3_bi7xkq,0,/r/CrazyIdeas/comments/bi7xkq/its_easier_to_turn_someone_into_a_cannibal_than_a/,2,,False,CrazyIdeas,"Its easier to turn someone into a cannibal than a high school graduate. Anyone can choose to quit school, but they cant always know whats in their burger.",https://www.reddit.com/r/CrazyIdeas/comments/bi7xkq/its_easier_to_turn_someone_into_a_cannibal_than_a/
783,MontyGrail,t3_bhmoyz,200,/r/CrazyIdeas/comments/bhmoyz/people_should_flood_reddit_with_fake_spoilers/,3035,As long as all the fakes sound real enough it'll get to the point where people think all of them are fake. Things that were actually spoiled will still surprise you because you didn't believe it would actually happen. Kind of like when a trailer scene dosent show up in the final cut.,False,CrazyIdeas,"People should flood Reddit with fake Spoilers whenever something spoiler-rich comes out, that way the people will assume the real ones are fake too.",https://www.reddit.com/r/CrazyIdeas/comments/bhmoyz/people_should_flood_reddit_with_fake_spoilers/
784,isananimal,t3_bi7td5,2,/r/CrazyIdeas/comments/bi7td5/free_near_death_experience_with_purchase_of/,2,,False,CrazyIdeas,free near death experience with purchase of assisted suicide,https://www.reddit.com/r/CrazyIdeas/comments/bi7td5/free_near_death_experience_with_purchase_of/
785,DieMensch-Maschine,t3_bi4pu2,0,/r/CrazyIdeas/comments/bi4pu2/create_a_gameshow_in_which_you_play_musical/,5,,False,CrazyIdeas,Create a gameshow in which you play musical chairs with toilets. Call it “The New Game of Thrones.”,https://www.reddit.com/r/CrazyIdeas/comments/bi4pu2/create_a_gameshow_in_which_you_play_musical/
786,greeneyeball,t3_bi11y3,5,/r/CrazyIdeas/comments/bi11y3/people_who_like_feet_should_be_called_pediphiles/,19,,False,CrazyIdeas,People who like feet should be called pediphiles,https://www.reddit.com/r/CrazyIdeas/comments/bi11y3/people_who_like_feet_should_be_called_pediphiles/
787,goomba870,t3_bi5q0j,0,/r/CrazyIdeas/comments/bi5q0j/boxes_of_tea_bags_should_indicate_if_the_bags/,4,,False,CrazyIdeas,Boxes of tea bags should indicate if the bags have attached strings or not.,https://www.reddit.com/r/CrazyIdeas/comments/bi5q0j/boxes_of_tea_bags_should_indicate_if_the_bags/
788,S_tupidlol,t3_bi4vo8,2,/r/CrazyIdeas/comments/bi4vo8/spiderman_would_be_a_lot_stronger_if_peter_parker/,6,,False,CrazyIdeas,Spider-Man would be a lot stronger if Peter Parker was living in Australia,https://www.reddit.com/r/CrazyIdeas/comments/bi4vo8/spiderman_would_be_a_lot_stronger_if_peter_parker/
789,Benasaurus_Rex,t3_bi8smu,2,/r/CrazyIdeas/comments/bi8smu/white_privilege_is_rebooting_full_house_but_not/,0,,False,CrazyIdeas,White privilege is rebooting Full House but not Family Matters,https://www.reddit.com/r/CrazyIdeas/comments/bi8smu/white_privilege_is_rebooting_full_house_but_not/
790,MrJoshTheEpic_,t3_bi75b4,3,/r/CrazyIdeas/comments/bi75b4/coordinate_groups_of_people_to_create_massive/,2,"Anyone who wants to be involved would set up a router either

a) directly on their own internet connection

or

b) connecting to, and extending, another router in the network via a wifi adapter plugged into the ethernet input on the router

and everyone involved in a network will agree on an ssid and password that all of the routers will be set up with so that devices recognize all of them as one network and can switch on the fly when moving between the ranges of each node.

A sprawling, decentralized network like this would provide several benefits to its users and the communities in which it is implemented, including but not limited to:

* **Free internet access from anywhere for everyone**, including those who might not otherwise be able to afford it

and

* **Protection from ISP blocking/throttling**. The decentralized nature of the network means that people with different providers would feed into the system, so anything is bound to load faster from somewhere even if one ISP blocks or throttles it",False,CrazyIdeas,Coordinate groups of people to create massive decentralized wifi networks - potentially even spanning entire countries,https://www.reddit.com/r/CrazyIdeas/comments/bi75b4/coordinate_groups_of_people_to_create_massive/
791,rosechisholm,t3_bi3eu5,1,/r/CrazyIdeas/comments/bi3eu5/always_throw_a_chair_at_a_mass_shooter/,5,"Always throw a chair at a mass shooter.  In United States,  there are more chairs than people.  It worked really well for me before the Irish mob came after us. 

There are members of the Houston Police Department that are in the Irish mob.  I am attaching a conversation with Detective Blanco for context.  https://clyp.it/l24huw2a
Nobody is this incompetent, therefore it must be deliberate.  Please save this link.  HPD deletes my posts quickly. HPD has a policy of not interacting with the troublemakers.  If you share this, they will leave you alone. God told me to take them down.",False,CrazyIdeas,Always throw a chair at a mass shooter,https://www.reddit.com/r/CrazyIdeas/comments/bi3eu5/always_throw_a_chair_at_a_mass_shooter/
792,bulletben7,t3_bi5f1c,2,/r/CrazyIdeas/comments/bi5f1c/microwave_ovens_should_have_a_reverse_mode_or_a/,3,,False,CrazyIdeas,"Microwave ovens should have a reverse mode, or a vent mode to cool your food down when it's finished.",https://www.reddit.com/r/CrazyIdeas/comments/bi5f1c/microwave_ovens_should_have_a_reverse_mode_or_a/
793,stayupthetree,t3_bi6kza,1,/r/CrazyIdeas/comments/bi6kza/music_streaming_services_should_have_a_playlist/,2,,False,CrazyIdeas,Music streaming services should have a playlist that will listen as you sing along and queue up songs more appropriate to your range.,https://www.reddit.com/r/CrazyIdeas/comments/bi6kza/music_streaming_services_should_have_a_playlist/
794,flopsyplum,t3_bi4duh,1,/r/CrazyIdeas/comments/bi4duh/force_elon_musk_to_commute_to_work_using_tesla/,5,,False,CrazyIdeas,Force Elon Musk to commute to work using Tesla Autopilot,https://www.reddit.com/r/CrazyIdeas/comments/bi4duh/force_elon_musk_to_commute_to_work_using_tesla/
795,Qanobi,t3_bi86tm,0,/r/CrazyIdeas/comments/bi86tm/its_finals_time_you_can_give_a_classmate_a_stroke/,1,,False,CrazyIdeas,"Its finals time. You can give a classmate a stroke by asking one simple question “How was the test?”, when you know there’s no test that day.",https://www.reddit.com/r/CrazyIdeas/comments/bi86tm/its_finals_time_you_can_give_a_classmate_a_stroke/
796,atomicgamesquad,t3_bi1e8a,8,/r/CrazyIdeas/comments/bi1e8a/billionaire_wwe_style_wrestling_matches_with_a/,5,,False,CrazyIdeas,Billionaire wwe style wrestling matches with a sea world splash zone called the cash zone,https://www.reddit.com/r/CrazyIdeas/comments/bi1e8a/billionaire_wwe_style_wrestling_matches_with_a/
797,collinnator5,t3_bi1e7h,0,/r/CrazyIdeas/comments/bi1e7h/movies_are_called_movies_because_they_are_moving/,8,,False,CrazyIdeas,Movies are called movies because they are “moving pictures”. Therefore regular pictures should be called “stillies”,https://www.reddit.com/r/CrazyIdeas/comments/bi1e7h/movies_are_called_movies_because_they_are_moving/
798,JohnnyRelentless,t3_bi0t14,3,/r/CrazyIdeas/comments/bi0t14/a_random_emoji_generator_app_so_you_can/,7,,False,CrazyIdeas,"A random emoji generator app, so you can effortlessly confuse people with emojis that have nothing at all to do with your text. 💅👀💩🤑🍾🍾🍾🍩",https://www.reddit.com/r/CrazyIdeas/comments/bi0t14/a_random_emoji_generator_app_so_you_can/
799,Boronthemoron,t3_bi2dh5,0,/r/CrazyIdeas/comments/bi2dh5/communities_should_collect_and_process_3d/,5,"It's too expensive and cumbersome for each hobbiest to have their own grinder and extruder to reprocess 3d printing scraps. I would love there to be a community level reprocessing clubs where everyone can take their scraps and have it processed communally. The reprocessed material will have questionable grade of course, but can be sold back to the recyclers at a lower cost than new filament. Maybe scraps can be collected by local sellers of filament?",False,CrazyIdeas,Communities should collect and process 3d printing scraps to prevent it from ending up in landfill.,https://www.reddit.com/r/CrazyIdeas/comments/bi2dh5/communities_should_collect_and_process_3d/
800,Cyno01,t3_bi790d,0,/r/CrazyIdeas/comments/bi790d/uber_should_add_a_feature_that_lets_you_hire_one/,1,Wife bought Endgame tickets not at our usual theater for no reason. We went to our usual theater... 22 miles away.,False,CrazyIdeas,Uber should add a feature that lets you hire one as a blocker car when you’re driving yourself but in an extra hurry.,https://www.reddit.com/r/CrazyIdeas/comments/bi790d/uber_should_add_a_feature_that_lets_you_hire_one/
801,soljaboss,t3_bi8s5c,7,/r/CrazyIdeas/comments/bi8s5c/governments_should_inspect_peoples_houses_to_stop/,0,"Governments around the world should have regular inspections of people's houses/basements/dungeons to deter human trafficking, abuse etc... (Im gonna be in so much trouble for this).",False,CrazyIdeas,Governments should inspect people's houses to stop trafficking/abuse,https://www.reddit.com/r/CrazyIdeas/comments/bi8s5c/governments_should_inspect_peoples_houses_to_stop/
802,rickiechard1,t3_bi6uid,4,/r/CrazyIdeas/comments/bi6uid/little_helmets_for_are_balls_helmet_balls/,1,,False,CrazyIdeas,Little helmets for are balls. Helmet balls.,https://www.reddit.com/r/CrazyIdeas/comments/bi6uid/little_helmets_for_are_balls_helmet_balls/
803,not_fred,t3_bi6tox,0,/r/CrazyIdeas/comments/bi6tox/flood_the_internet_with_fake_spoilers_that/,0,People who haven't seen the movie won't know which spoilers are true. Michael Scott uses a similar strategy when he spreads a rumour that he wishes he could take back.,False,CrazyIdeas,"Flood the internet with fake spoilers that contradict each other but are all equally plausible, effectively making all spoilers meaningless",https://www.reddit.com/r/CrazyIdeas/comments/bi6tox/flood_the_internet_with_fake_spoilers_that/
804,Rhesusmonkeydave,t3_bi6kqe,1,/r/CrazyIdeas/comments/bi6kqe/bandwagon_time_what_the_world_really_needs_is/,1,"I know, like zombies before them, Battle Royal games are quickly wearing out their welcome.   That said, bear with me!   Team or solo play Letter Looting, gathering up vowels and consonants to build words.   The bigger the word you successfully build in your inventory and submit, the more powerful an airdrop you can call down.   Airdrops contain weapons or rare/valuable letters to build better words.  Maintaining control of various areas of the map allows for point bonuses (double word, letter score etc) 


This way I can play scrabble/ words with friends without my random opponent making three plays and then VANISHING FOR THE REST OF HUMAN HISTORY.

See you on the battlefield!",False,CrazyIdeas,Bandwagon time: What the world really needs is: BattleRoyale Scrabble!,https://www.reddit.com/r/CrazyIdeas/comments/bi6kqe/bandwagon_time_what_the_world_really_needs_is/
805,Sycration,t3_bi09ns,1,/r/CrazyIdeas/comments/bi09ns/if_you_killed_ted_cruz_and_snowboarded_with_his/,7,,False,CrazyIdeas,"If you killed Ted Cruz and snowboarded with his body, you would be declared insane and go to jail for a long time.",https://www.reddit.com/r/CrazyIdeas/comments/bi09ns/if_you_killed_ted_cruz_and_snowboarded_with_his/
806,star7500,t3_bi0pdu,7,/r/CrazyIdeas/comments/bi0pdu/online_dating_services_should_have_a_rating_system/,7,"Other users should be able to rate your looks.  Like whenever they see your profile they're prompted to rate you from 1 -10.  This way people can sort their messages by rating, and the service is more likely to match you with someone in your league.",False,CrazyIdeas,Online dating services should have a rating system,https://www.reddit.com/r/CrazyIdeas/comments/bi0pdu/online_dating_services_should_have_a_rating_system/
807,look-an-idiot,t3_bi6ada,0,/r/CrazyIdeas/comments/bi6ada/change_all_of_the_photos_gif_and_videos_on_mobile/,1,I was just scrolling through and I thought this would be a cool idea. It would also keep everything centered at all times,False,CrazyIdeas,Change all of the photos gif and videos on mobile to parallax scrolling,https://www.reddit.com/r/CrazyIdeas/comments/bi6ada/change_all_of_the_photos_gif_and_videos_on_mobile/
808,GrayWalle,t3_bhzme4,0,/r/CrazyIdeas/comments/bhzme4/i_want_to_see_john_stockton_and_karl_malone_join/,9,,False,CrazyIdeas,I want to see John Stockton and Karl Malone join Twitter just so John can make seemingly random observations that end up being setups for Karl to deliver the punchline.,https://www.reddit.com/r/UtahJazz/comments/bhyekv/i_want_to_see_john_stockton_and_karl_malone_join/
809,EveningMuffin,t3_bi5txp,0,/r/CrazyIdeas/comments/bi5txp/it_should_be_customary_to_burp_after_a_steamy/,1,To show you really enjoyed it,False,CrazyIdeas,It should be customary to burp after a steamy make out session.,https://www.reddit.com/r/CrazyIdeas/comments/bi5txp/it_should_be_customary_to_burp_after_a_steamy/
810,olliedawg,t3_bi5qe3,0,/r/CrazyIdeas/comments/bi5qe3/the_predator_package_the_ultimate_trophy_hunting/,1,"Willing participants will be given a list of animals to choose from with different time limits set for each. The chosen animal and its respective time limit are then programmed into a time bomb locked around the hunter's wrist giving them a set time to prepare, track and kill said animal before the bomb detonates. An opt out function can also be programmed into the wrist bomb for an additional fee so that customers who change their minds can avoid detonation if they fear that they may fail.",False,CrazyIdeas,The Predator Package. The ultimate trophy hunting experience only for the bravest of the brave.,https://www.reddit.com/r/CrazyIdeas/comments/bi5qe3/the_predator_package_the_ultimate_trophy_hunting/
811,4little_weirdos,t3_bi09d9,7,/r/CrazyIdeas/comments/bi09d9/elon_musks_sperm_100_most_intelligent_women/,4,What happens now?,False,CrazyIdeas,Elon Musk's Sperm + 100 Most Intelligent Women=,https://www.reddit.com/r/CrazyIdeas/comments/bi09d9/elon_musks_sperm_100_most_intelligent_women/
812,Siekmeng,t3_bhy800,1,/r/CrazyIdeas/comments/bhy800/optical_illusions_should_be_called_brain_failures/,8,,False,CrazyIdeas,Optical illusions should be called brain failures because that’s exactly what they are,https://www.reddit.com/r/CrazyIdeas/comments/bhy800/optical_illusions_should_be_called_brain_failures/
813,sheng_shu,t3_bi49ax,0,/r/CrazyIdeas/comments/bi49ax/someone_should_say_god_is_clearly_faked_and_make/,1,,False,CrazyIdeas,"Someone should say god is clearly faked and make a video photoshopping a picture of god for all creationists who think black hole doesn’t exit, earth is flat with a dome, etc etc.",https://www.reddit.com/r/CrazyIdeas/comments/bi49ax/someone_should_say_god_is_clearly_faked_and_make/
814,thesalemx,t3_bi3w2h,1,/r/CrazyIdeas/comments/bi3w2h/like_snow_and_hail_but_their_roles_are_reversed/,1,,False,CrazyIdeas,"Like, snow and hail, but their roles are reversed. It hails all the time during winter and snows during heavy thunderstorms.",https://www.reddit.com/r/CrazyIdeas/comments/bi3w2h/like_snow_and_hail_but_their_roles_are_reversed/
815,Sujjin,t3_bi1erm,3,/r/CrazyIdeas/comments/bi1erm/political_ballots_should_have_the_names/,2,this way people might be more inclined to finds out who the candidates are and what they have voted on in the past before throwing their support behind them.,False,CrazyIdeas,Political ballots should have the names randomized on the ballot an party designation removed.,https://www.reddit.com/r/CrazyIdeas/comments/bi1erm/political_ballots_should_have_the_names/
816,ancientshadow,t3_bhvt1k,4,/r/CrazyIdeas/comments/bhvt1k/all_electric_vehicles_should_have_a_universal/,16,,False,CrazyIdeas,All electric vehicles should have a universal charging port and not any proprietary port. Anyone can charge their car everywhere.,https://www.reddit.com/r/CrazyIdeas/comments/bhvt1k/all_electric_vehicles_should_have_a_universal/
817,nicer_abhas,t3_bhxlgg,3,/r/CrazyIdeas/comments/bhxlgg/all_subreddits_should_have_a_youtube_channel/,5,I guess that's legal in some way as copyright laws on Youtube are pretty whack.This can also keep on check on channels which profit from reddit posts without much effort.,False,CrazyIdeas,"All subreddits should have a Youtube channel which will copyright claim all the ""r/"" videos they find on Youtube.",https://www.reddit.com/r/CrazyIdeas/comments/bhxlgg/all_subreddits_should_have_a_youtube_channel/
818,georgedoubleyoubush,t3_bi2pok,3,/r/CrazyIdeas/comments/bi2pok/every_year_the_government_should_select_30/,0,"Like they get psychologists to examine inmates on the death row to see if they deserve a second chance. guards could maybe recommend inmates. 30 may be alot, but theres over 2000 currently on the death row",False,CrazyIdeas,"Every year, the government should select 30 prisoners on the deathrow and set them free",https://www.reddit.com/r/CrazyIdeas/comments/bi2pok/every_year_the_government_should_select_30/
819,Astroclty,t3_bhu159,6,/r/CrazyIdeas/comments/bhu159/a_6month_long_period_in_your_20s_where_you_are/,20,"Not trying to be political at all here, but I personally think that there should be a period in everyone's life where they can just try to enjoy life. I'm not saying that that isn't a thing in our world, lots of people do that, but for the most part, those people either aren't worried about their financial situation during and after that time or they say ""f\*\*\* it"" and don't care about it until it hits them when they get back home.",False,CrazyIdeas,A 6-month long period in your 20's where you are encouraged to explore the world and yourself without financial stress,https://www.reddit.com/r/CrazyIdeas/comments/bhu159/a_6month_long_period_in_your_20s_where_you_are/
820,pmclane76,t3_bhxy68,2,/r/CrazyIdeas/comments/bhxy68/a_clip_share_feature_on_netflix_that_lets_u/,3,Would be great for memorable quotes and would be a fun way to engage users and their networks .,False,CrazyIdeas,A clip share feature on Netflix that lets u record and share up to 15 seconds of what you are watching.,https://www.reddit.com/r/CrazyIdeas/comments/bhxy68/a_clip_share_feature_on_netflix_that_lets_u/
821,TheManicMonocle,t3_bhvig7,1,/r/CrazyIdeas/comments/bhvig7/put_a_garbage_disposal_the_spinning_blade_thing/,6,,False,CrazyIdeas,Put a garbage disposal (the spinning blade thing) on the bottom of toilets to break up clogs.,https://www.reddit.com/r/CrazyIdeas/comments/bhvig7/put_a_garbage_disposal_the_spinning_blade_thing/
822,SecondRealitySims,t3_bhz4sq,3,/r/CrazyIdeas/comments/bhz4sq/seeing_as_hell_needs_to_produce_endless_suffering/,0,,False,CrazyIdeas,"Seeing as Hell needs to produce endless suffering, it would be custom tailored to the person. And therefor, some people’s Hell experience would be dying and seeing there’s no afterlife, or Hell itself as a way to play off their emotions and produce the most suffering",https://www.reddit.com/r/CrazyIdeas/comments/bhz4sq/seeing_as_hell_needs_to_produce_endless_suffering/
