,author,name,num_comments,permalink,score,selftext,stickied,subreddit,title,url
250,Crocosaw,t3_bl5nys,1,/r/CrazyIdeas/comments/bl5nys/nike_cryptocurrancy_via_running/,1,"Nike makes a shoe that detects your footfalls and knows when you're running. It keeps track and you earn Cryptocurrancy from running. People who run huge amounts could earn a decent amount of money this way, and people who think they run a lot would buy it for the high price. They could make it seem like they're doing it to get people running more, marketing it that way, making them seem like a company that cares and wants tp reward people for staying active.",False,CrazyIdeas,Nike Cryptocurrancy via running,https://www.reddit.com/r/CrazyIdeas/comments/bl5nys/nike_cryptocurrancy_via_running/
251,OhNoASnake64,t3_bl5hem,1,/r/CrazyIdeas/comments/bl5hem/all_of_humanitys_problems_would_be_solved_if_we/,0,,False,CrazyIdeas,"All of humanity’s problems would be solved if we lived like cavemen ( Global warming, overpopulation, etc).",https://www.reddit.com/r/CrazyIdeas/comments/bl5hem/all_of_humanitys_problems_would_be_solved_if_we/
252,potatohamchop,t3_bl33hh,2,/r/CrazyIdeas/comments/bl33hh/dodge_should_start_manufacturing_memory_sticks/,3,,False,CrazyIdeas,Dodge should start manufacturing memory sticks,https://www.reddit.com/r/CrazyIdeas/comments/bl33hh/dodge_should_start_manufacturing_memory_sticks/
253,Inferno8,t3_bl2g8c,0,/r/CrazyIdeas/comments/bl2g8c/a_reality_show_where_each_week_we_release_a_herd/,2,,False,CrazyIdeas,A reality show where each week we release a herd of coked-up kangaroos in a ghetto.,https://www.reddit.com/r/CrazyIdeas/comments/bl2g8c/a_reality_show_where_each_week_we_release_a_herd/
254,nooneisanonymous,t3_bkznnh,4,/r/CrazyIdeas/comments/bkznnh/a_library_that_scans_and_distributes_free_pdf/,4,,False,CrazyIdeas,A library that scans and distributes free pdf files of books which are not currently copyrighted.,https://www.reddit.com/r/CrazyIdeas/comments/bkznnh/a_library_that_scans_and_distributes_free_pdf/
255,rapunzelsasshair,t3_bl4r9z,0,/r/CrazyIdeas/comments/bl4r9z/an_app_called_kazaam_for_when_you_dont_know_the/,0,,False,CrazyIdeas,"An App called ""Kazaam"" for when you don't know the name of a song that's playing so Shaq shows up dressed like a genie and makes it rain candy",https://www.reddit.com/r/CrazyIdeas/comments/bl4r9z/an_app_called_kazaam_for_when_you_dont_know_the/
256,TibbeOrdelman,t3_bkx32d,0,/r/CrazyIdeas/comments/bkx32d/we_see_gray_in_gradients_and_some_shrimps_se_a/,7,,False,CrazyIdeas,"We see gray in gradients, and some shrimps se a wider variety of colors than we do, so our gradients of gray could be a bright happy color for them",https://www.reddit.com/r/CrazyIdeas/comments/bkx32d/we_see_gray_in_gradients_and_some_shrimps_se_a/
257,GeneralFactotum,t3_bl09yu,1,/r/CrazyIdeas/comments/bl09yu/design_a_toilet_that_vents_the_stink_outside_as/,3,,False,CrazyIdeas,Design a toilet that vents the stink outside as you sit.,https://www.reddit.com/r/CrazyIdeas/comments/bl09yu/design_a_toilet_that_vents_the_stink_outside_as/
258,thinkreate,t3_bl46gx,0,/r/CrazyIdeas/comments/bl46gx/nasa_should_hire_weird_al_to_parody_metallicas/,1,,False,CrazyIdeas,"NASA should hire Weird Al to parody Metallica’s “Welcome Home (Sanatarium),” and call it Planetarium.",https://www.reddit.com/r/CrazyIdeas/comments/bl46gx/nasa_should_hire_weird_al_to_parody_metallicas/
259,goda90,t3_bkxu51,0,/r/CrazyIdeas/comments/bkxu51/if_and_when_reddit_shuts_down_we_should_all_put_a/,6,https://en.m.wikipedia.org/wiki/Tontine,False,CrazyIdeas,"If and when Reddit shuts down, we should all put a few cents in a tontine that will be awarded to the last surviving Redditor.",https://www.reddit.com/r/CrazyIdeas/comments/bkxu51/if_and_when_reddit_shuts_down_we_should_all_put_a/
260,JaredLiwet,t3_bl1328,1,/r/CrazyIdeas/comments/bl1328/smuggle_a_microsd_card_across_a_bordertsa_line/,2,,False,CrazyIdeas,Smuggle a microSD card across a border/TSA line that has 95 million text documents containing the 4th Amendment,https://www.reddit.com/r/CrazyIdeas/comments/bl1328/smuggle_a_microsd_card_across_a_bordertsa_line/
261,caseycityhall,t3_bl3ijb,0,/r/CrazyIdeas/comments/bl3ijb/an_entire_ted_bundy_streaming_service/,1,,False,CrazyIdeas,An entire Ted Bundy streaming service,https://www.reddit.com/r/CrazyIdeas/comments/bl3ijb/an_entire_ted_bundy_streaming_service/
262,accoun2,t3_bl3ida,3,/r/CrazyIdeas/comments/bl3ida/a_real_time_chat_based_discussion_service/,1,"
So I was thinking of a real time chat service where you could make a post and instantly start a chat with a group of people interested in the topic. Unlike forums you can get instant replies on your post and it will also be more like a discussion. Putting aside all the complexity involved in actually creating something like this, would you want to spend time having discussion about stuff you are interested in with random strangers on the internet?


Can this be a good real time chat service? You make a post about your topic, as in a reddit post, which creates a live chat room for people to discuss on the topic in the room, (apart from the normal comment section), would a group chat be a more lively discussion and would it make it better?",False,CrazyIdeas,A real time chat based discussion service,https://www.reddit.com/r/CrazyIdeas/comments/bl3ida/a_real_time_chat_based_discussion_service/
263,lazerbolt52,t3_bkynto,1,/r/CrazyIdeas/comments/bkynto/sonic_never_looked_that_bad_outside_the_trailers/,3,"The 'reworked"" sonic we will get will be the same sonic either way. This hideous abomination was used to stir up controversy for the movie. It would be impossible to re animate that much in such a short time frame",False,CrazyIdeas,Sonic never looked that bad outside the trailers. It was used to stir up controversy.,https://www.reddit.com/r/CrazyIdeas/comments/bkynto/sonic_never_looked_that_bad_outside_the_trailers/
264,scarsaver,t3_bl2l21,2,/r/CrazyIdeas/comments/bl2l21/a_phone_that_makes_a_hologram/,1,,False,CrazyIdeas,A phone that makes a hologram,https://www.reddit.com/r/CrazyIdeas/comments/bl2l21/a_phone_that_makes_a_hologram/
265,TestForPotential,t3_bkthx9,6,/r/CrazyIdeas/comments/bkthx9/texting_an_ex_should_be_called_exting/,23,,False,CrazyIdeas,Texting an “ex” should be called “exting”.,https://www.reddit.com/r/CrazyIdeas/comments/bkthx9/texting_an_ex_should_be_called_exting/
266,SuperPotatoPancakes,t3_bku1cg,2,/r/CrazyIdeas/comments/bku1cg/join_antivaccine_communities_by_the_thousands/,18,,False,CrazyIdeas,"Join anti-vaccine communities by the thousands, pretending to be anti-vaccine. Then, about a year later, have one of us share a pro-vaccine idea, with the rest of us agreeing and deciding that vaccines aren't bad after all​. Using peer pressure, we could convince anti-vaxxers to vaccinate.",https://www.reddit.com/r/CrazyIdeas/comments/bku1cg/join_antivaccine_communities_by_the_thousands/
267,TeeheeBoss,t3_bl2ijh,0,/r/CrazyIdeas/comments/bl2ijh/a_duolingo_for_learning_different_accents/,1,,False,CrazyIdeas,A Duolingo for learning different accents,https://www.reddit.com/r/CrazyIdeas/comments/bl2ijh/a_duolingo_for_learning_different_accents/
268,Serot0nic,t3_bkzoux,1,/r/CrazyIdeas/comments/bkzoux/create_a_single_news_channel_crowdsourced_by/,2,"- Current students submit articles
- Articles have to be sourced
- Moderated by professors and graduates

Basically a national map of content akin to u/PoppinKREAM would be pretty neat to say the least.",False,CrazyIdeas,Create a single news channel crowd-sourced by public universities,https://www.reddit.com/r/CrazyIdeas/comments/bkzoux/create_a_single_news_channel_crowdsourced_by/
269,gapipkin,t3_bkovm4,6,/r/CrazyIdeas/comments/bkovm4/a_cooking_show_where_celebrity_chefs_are_judged/,90,I’m tired of watching these cooking shows with them making stuff that people don’t really eat. I’d rather see them make dishes my kids would enjoy. Extra points if they can get them to eat their vegetables.,False,CrazyIdeas,A cooking show where celebrity chefs are judged by 5 year olds.,https://www.reddit.com/r/CrazyIdeas/comments/bkovm4/a_cooking_show_where_celebrity_chefs_are_judged/
270,mat_withone_t,t3_bkva9q,2,/r/CrazyIdeas/comments/bkva9q/hand_free_mode_a_feature_that_makes_reddit_slowly/,10,,False,CrazyIdeas,Hand free mode: A feature that makes Reddit slowly scroll down so you can browse while eating.,https://www.reddit.com/r/CrazyIdeas/comments/bkva9q/hand_free_mode_a_feature_that_makes_reddit_slowly/
271,ComplexPirate,t3_bkzdah,0,/r/CrazyIdeas/comments/bkzdah/someone_should_design_an_app_or_something_that/,1,,False,CrazyIdeas,Someone should design an app or something that can relate to anyone’s life whether bad or good to give them choices what they can do with f they experience an obstacle?,https://www.reddit.com/r/CrazyIdeas/comments/bkzdah/someone_should_design_an_app_or_something_that/
272,Mutant_Llama1,t3_bl219f,2,/r/CrazyIdeas/comments/bl219f/youtube_should_have_the_leastviewed_videos_at_the/,0,"The ones that are popular, people already know about. You don't want everybody watching the same 5 videos repeatedly.",False,CrazyIdeas,Youtube should have the least-viewed videos at the top.,https://www.reddit.com/r/CrazyIdeas/comments/bl219f/youtube_should_have_the_leastviewed_videos_at_the/
273,Kuritos,t3_bkxpnv,2,/r/CrazyIdeas/comments/bkxpnv/travel_to_a_dimension_where_you_are_the_opposite/,3,"After that, pulverize the child, throw the dust in some flour, bake it, and serve. You're a deranged baker, and your inbred child is inbread.",False,CrazyIdeas,"Travel to a dimension where you are the opposite sex; work on conceiving a child with yourself, and create the ultimate inbred",https://www.reddit.com/r/CrazyIdeas/comments/bkxpnv/travel_to_a_dimension_where_you_are_the_opposite/
274,NativeSonSF,t3_bl1m7b,1,/r/CrazyIdeas/comments/bl1m7b/an_option_on_the_uber_app_where_you_can_take_over/,1,,False,CrazyIdeas,An option on the Uber app where you can take over for your driver if they doesn’t know where they're going.,https://www.reddit.com/r/CrazyIdeas/comments/bl1m7b/an_option_on_the_uber_app_where_you_can_take_over/
275,p3p3_sylvia,t3_bl13ck,1,/r/CrazyIdeas/comments/bl13ck/an_option_disclaimer_on_car_bluetooth_settings/,1,,False,CrazyIdeas,An option/ disclaimer on car Bluetooth settings that allows the passenger to connect a device while the car is moving.,https://www.reddit.com/r/CrazyIdeas/comments/bl13ck/an_option_disclaimer_on_car_bluetooth_settings/
276,ItsRainingCatsnDogs,t3_bkskm4,1,/r/CrazyIdeas/comments/bkskm4/funeral_kahoot/,15,a kahoot about your life at your funeral.,False,CrazyIdeas,funeral kahoot.,https://www.reddit.com/r/CrazyIdeas/comments/bkskm4/funeral_kahoot/
277,brozilla456,t3_bkpy5i,3,/r/CrazyIdeas/comments/bkpy5i/tinder_should_show_your_antimatch_an_interstitial/,31,,False,CrazyIdeas,"Tinder should show your anti-match, an interstitial for when you mutually dislike someone: “Don’t worry, the feeling’s mutual.”",https://www.reddit.com/r/CrazyIdeas/comments/bkpy5i/tinder_should_show_your_antimatch_an_interstitial/
278,dr_fogs,t3_bkzj00,4,/r/CrazyIdeas/comments/bkzj00/why_does_facebook_not_offer_plans_where_i_can_pay/,0,,False,CrazyIdeas,Why does Facebook not offer plans where I can pay with actual money instead of being forced to pay with my privacy? How much would that have to be?,https://www.reddit.com/r/CrazyIdeas/comments/bkzj00/why_does_facebook_not_offer_plans_where_i_can_pay/
279,BamboozleBird,t3_bktmm2,0,/r/CrazyIdeas/comments/bktmm2/plant_bamboo_in_peoples_yards_and_call_yourself/,8,"Bamboo grows super fast and is pretty annoying to get rid of so you could just go into your neighbor’s, enemy’s, or just a random person’s yard and plant bamboo. Before they notice and figure out how to get rid of it, it has already grown a lot. Your super villain name can be The Bamboozler and you can drop some kind of card with that name on the crime scenes.",False,CrazyIdeas,Plant bamboo in people’s yards and call yourself The Bamboozler,https://www.reddit.com/r/CrazyIdeas/comments/bktmm2/plant_bamboo_in_peoples_yards_and_call_yourself/
280,someguy00004,t3_bkbck9,117,/r/CrazyIdeas/comments/bkbck9/bot_that_scans_the_entirety_of_reddit_for_the/,5581,,False,CrazyIdeas,"Bot that scans the entirety of reddit for the earliest instance of an image, and credits all the karma to the person that posted it.",https://www.reddit.com/r/CrazyIdeas/comments/bkbck9/bot_that_scans_the_entirety_of_reddit_for_the/
281,LeDankster,t3_bkypfk,2,/r/CrazyIdeas/comments/bkypfk/having_extra_chromosomes_gives_you_down_syndrome/,0,,False,CrazyIdeas,"Having extra chromosomes gives you down syndrome, so we should genetically modify humans to have less chromosomes and create gods.",https://www.reddit.com/r/CrazyIdeas/comments/bkypfk/having_extra_chromosomes_gives_you_down_syndrome/
282,Mutant_Llama1,t3_bkyeux,2,/r/CrazyIdeas/comments/bkyeux/if_satan_just_had_a_machine_gun_apparently_the/,0,,False,CrazyIdeas,"If Satan just had a machine gun, apparently the angels just have bows and arrows and harps.",https://www.reddit.com/r/CrazyIdeas/comments/bkyeux/if_satan_just_had_a_machine_gun_apparently_the/
283,PM_CUTE_BUTT,t3_bkxrj9,0,/r/CrazyIdeas/comments/bkxrj9/rerelease_avatar_2009_for_theaters_so_that/,1,What even is an avenger and why it want make more money than blue Pocahontas,False,CrazyIdeas,Re-release Avatar (2009) for theaters so that Avengers: Endgame can’t surpass its box office total,https://www.reddit.com/r/CrazyIdeas/comments/bkxrj9/rerelease_avatar_2009_for_theaters_so_that/
284,rejjie_carter,t3_bkxnji,3,/r/CrazyIdeas/comments/bkxnji/the_richest_civilization_to_ever_exist_should/,0,So crazy it just might work,False,CrazyIdeas,The richest civilization to ever exist should reimburse the descendants of the enslaved people who built it,https://www.reddit.com/r/CrazyIdeas/comments/bkxnji/the_richest_civilization_to_ever_exist_should/
285,Icarixx,t3_bkx80g,6,/r/CrazyIdeas/comments/bkx80g/depression_a_modern_age_problem_and_how_to_solve/,0,"I think the solution to lessen depression and anxiety is when we have less privacy on the internet. It sounds stupid, but I think the main reason we are depressed is due to the fact that we compare ourselves everyday to supposedly 'better' people. If we could know everyone's flaws, then we wouldn't be seeing them as a 'perfect' human being. So we wouldn't be ashamed of our failures, because others have them too, and we wouldn't be having unrealistic standards for live. People would also stop looking down on others, because their failures are visible as well, it will bring mutual respect for the person or even genuine compassion. I don't know how we're going to do this, but I think less privacy on the internet would be, ironically, better. If we can just see the bad sides of someones life aswell, it would be beneficial in my opinion.

Ofcourse I have not covered all the flaws in this idea, since it's a problem too big for me to solve myself. The concept is what matters, the practical stuff comes later. Internet was impossible a few decades as well, so this must be possible. If you have any questions or thoughts on this topic, put them down below.",False,CrazyIdeas,"Depression. A modern age problem, and how to solve it.",https://www.reddit.com/r/CrazyIdeas/comments/bkx80g/depression_a_modern_age_problem_and_how_to_solve/
286,TizzioCaio,t3_bkwxyx,4,/r/CrazyIdeas/comments/bkwxyx/a_unpopular_opinion_that_is_upvoted_by_many_is_by/,0," 

\[Further explanation\]

The unpopularopinion memes, websites, section and even the subreddit here is such a farce that always end up with obvious popular opinions been voted in mass while majority of voters think they are unpopular, when is clearly the opposite

And some things are even weekly brought to the top with 2k+ points each time

All this fake unpopular things end up just an echo chamber for a brainless bandwagon train that pushes on top the most popular things

**A true unpopular-opinion subreddit** should automatically freeze/shame a post and the users that upvoted it after reaches a certain amount of points/upvotes and build a karma bandwagon to tag all users that upvoted such obvious popular opinions, with no excuse given

&amp;#x200B;

Basically a mix system of how Black Mirror episodes of Nosedive and Hated in the Nation how ppl are exposed

And tag/expose users that bandwagon up vote popular opinions

The subreddit itself [https://np.reddit.com/r/blackmirror/](https://np.reddit.com/r/blackmirror/)  haves a similar rating tracking involved next to the user name(open a post and look at stars)

Then there are already bots in some subreddits that also auto tag users based on their post/comment history

The system is there but it seems ppl just prefer to keep the fake facade up there instead of doing a true social change/evolution to the current complacency

&amp;#x200B;

PS: just to give people a taste of current ""unpopular"" opinions i seen, here is the basic message in some top posts from last days.

""I like to be adult""

""Keep your kids silent in cinema""

""Emotion can influence your objective thought""

""GMO are ok""

""I like having adblock active""

etc..Just browse the subreddit by top and put an interval of time and will understand

Half of them even got gold and are on 10k+ points..

If people dont see the absurdity of that i dont know how else to explain it.

&amp;#x200B;

PPS:why i dint post this or something similar there or in a more appropriate subreddit? because apparently meta(even referring another subreddit like black mirrors system example is considered META) posts are forbidden in a lot of section/subreddit ¯\\\_(ツ)\_/¯",False,CrazyIdeas,"A unpopular opinion that is upvoted by many is by default a fake unpopular opinion, and is quite popular, ppl who upvoted it should by tagged with a special negative rating for future reference.",https://www.reddit.com/r/CrazyIdeas/comments/bkwxyx/a_unpopular_opinion_that_is_upvoted_by_many_is_by/
287,thot--hunter,t3_bkwwlo,0,/r/CrazyIdeas/comments/bkwwlo/this/,1,http://chng.it/JPQJ2wZL8V,False,CrazyIdeas,This,https://www.reddit.com/r/CrazyIdeas/comments/bkwwlo/this/
288,GoogMastr,t3_bkt6gd,3,/r/CrazyIdeas/comments/bkt6gd/the_usmexico_border_is_now_a_game_show_obstacle/,4,"Just take the Wipeout course or the American Ninja Warrior one.

""uh oh looks like Guillermo didn't get past the Big Red Balls and fell into the water, which means he's on his way back to Chihuahua. Better luck next time Hombre.""",False,CrazyIdeas,The US-Mexico border is now a Game Show Obstacle Course with the grand prize of Citizenship if you can clear it,https://www.reddit.com/r/CrazyIdeas/comments/bkt6gd/the_usmexico_border_is_now_a_game_show_obstacle/
289,Aveladenn,t3_bkpzsm,3,/r/CrazyIdeas/comments/bkpzsm/policemen_when_chasing_a_criminal_on_foot_should/,12,"In France they would shout ""PimponPimponPimpon""",False,CrazyIdeas,"Policemen, when chasing a criminal on foot, should be shouting ""WeeoooWeeoooWeeoo""",https://www.reddit.com/r/CrazyIdeas/comments/bkpzsm/policemen_when_chasing_a_criminal_on_foot_should/
290,elipse173,t3_bkwgqo,1,/r/CrazyIdeas/comments/bkwgqo/with_all_the_profit_that_marvel_movies_are_making/,0,,False,CrazyIdeas,"With all the profit that Marvel movies are making, could the government fund the next few movies and then use the profits to pay for universal healthcare etc?",https://www.reddit.com/r/CrazyIdeas/comments/bkwgqo/with_all_the_profit_that_marvel_movies_are_making/
291,Pressedforwords,t3_bkqfoy,0,/r/CrazyIdeas/comments/bkqfoy/a_gofundme_for_cancelled_tv_shows_to_film_a/,9,,False,CrazyIdeas,A GoFundMe for cancelled TV shows to film a concluding episode.,https://www.reddit.com/r/CrazyIdeas/comments/bkqfoy/a_gofundme_for_cancelled_tv_shows_to_film_a/
292,TapWater42,t3_bkqbqq,1,/r/CrazyIdeas/comments/bkqbqq/disney_should_make_a_tv_show_where_each_episode/,11,,False,CrazyIdeas,Disney should make a TV show where each episode is a different way Dr Strange saw Thanos beat the Avengers,https://www.reddit.com/r/CrazyIdeas/comments/bkqbqq/disney_should_make_a_tv_show_where_each_episode/
293,psykotic24,t3_bktr80,1,/r/CrazyIdeas/comments/bktr80/if_cars_do_donuts_then_when_boats_do_it_it_should/,4,,False,CrazyIdeas,"If cars do donuts then when boats do it, it should be called froot loops",https://www.reddit.com/r/CrazyIdeas/comments/bktr80/if_cars_do_donuts_then_when_boats_do_it_it_should/
294,Paranoidas,t3_bktlo8,0,/r/CrazyIdeas/comments/bktlo8/a_restaurant_where_you_have_the_option_to_spin_a/,3,,False,CrazyIdeas,A restaurant where you have the option to spin a roulette wheel to pick your meal.,https://www.reddit.com/r/CrazyIdeas/comments/bktlo8/a_restaurant_where_you_have_the_option_to_spin_a/
295,extreme-anger,t3_bkrvq7,4,/r/CrazyIdeas/comments/bkrvq7/take_a_beloved_video_game_character_announce_a/,5,,False,CrazyIdeas,"Take a beloved video game character, announce a movie, and then make a model look completely terrible and unlike what fans want and use it in a trailer. When the expected backlash comes, pretend that it was unexpected and get free marketing, then use the regular model in the movie.",https://www.reddit.com/r/CrazyIdeas/comments/bkrvq7/take_a_beloved_video_game_character_announce_a/
296,juanjocasamitjana,t3_bkomq1,2,/r/CrazyIdeas/comments/bkomq1/dont_know_if_this_is_the_correct_sub_to_ask_this/,13,,False,CrazyIdeas,"Don't know if this is the correct sub to ask this, but can someone from Auckland (New Zealand) help me make an Earth sandwich",https://www.reddit.com/r/CrazyIdeas/comments/bkomq1/dont_know_if_this_is_the_correct_sub_to_ask_this/
297,IndustryApologist,t3_bkqp8u,0,/r/CrazyIdeas/comments/bkqp8u/anyone_who_is_caught_driving_impaired_should_be/,6,,False,CrazyIdeas,Anyone who is caught driving impaired should be permanently signed up as an organ donor.,https://www.reddit.com/r/CrazyIdeas/comments/bkqp8u/anyone_who_is_caught_driving_impaired_should_be/
298,NativeSonSF,t3_bkofr6,0,/r/CrazyIdeas/comments/bkofr6/let_police_personnel_carry_swords_again/,11,"Not as deadly as guns but sure to subdue an unruly perpetrator quickly. Plus, looks badass.",False,CrazyIdeas,Let police personnel carry swords again.,https://www.reddit.com/r/CrazyIdeas/comments/bkofr6/let_police_personnel_carry_swords_again/
299,minimalistforlifeee,t3_bkv8fc,10,/r/CrazyIdeas/comments/bkv8fc/make_streaming_subscription_service_for_ebooks/,1,Like Netflix but for electronic books or audiobooks. Have a library to choose from for 10 dollars a month and stream whatever you want,False,CrazyIdeas,Make streaming subscription service for ebooks and audiobooks,https://www.reddit.com/r/CrazyIdeas/comments/bkv8fc/make_streaming_subscription_service_for_ebooks/
300,Philks_85,t3_bkkym0,4,/r/CrazyIdeas/comments/bkkym0/buy_some_mannequins_dress_them_in_various_outfits/,29,,False,CrazyIdeas,"Buy some mannequins, dress them in various outfits and spray them top to bottom in metallic paint. You now have an army of ""human"" statues to place around a city. Place a simple sign saying ""thank you"" on a bucket and over the day just do a loop to change thier positions. Easy money.",https://www.reddit.com/r/CrazyIdeas/comments/bkkym0/buy_some_mannequins_dress_them_in_various_outfits/
301,31moreyears,t3_bkqtko,2,/r/CrazyIdeas/comments/bkqtko/a_reality_show_where_the_participants_have_to_be/,5,,False,CrazyIdeas,A reality show where the participants have to be handcuffed next to an annoying celebrity for 24 hours to win a cash prize. You lose if you get mad or fail to remain handcuffed for 24 hours.,https://www.reddit.com/r/CrazyIdeas/comments/bkqtko/a_reality_show_where_the_participants_have_to_be/
302,qwerty-if,t3_bkras9,0,/r/CrazyIdeas/comments/bkras9/drink_the_whole_jug_of_hummingbird_nectar/,5,,False,CrazyIdeas,Drink the whole jug of hummingbird nectar,https://www.reddit.com/r/CrazyIdeas/comments/bkras9/drink_the_whole_jug_of_hummingbird_nectar/
303,boyobenign98,t3_bkux0i,3,/r/CrazyIdeas/comments/bkux0i/popcorn_chicken_made_from_deep_fried_chicken/,0,It's a whole fried chicken... but tiny,False,CrazyIdeas,Popcorn chicken made from deep fried chicken fetuses.,https://www.reddit.com/r/CrazyIdeas/comments/bkux0i/popcorn_chicken_made_from_deep_fried_chicken/
304,Kaje26,t3_bks231,1,/r/CrazyIdeas/comments/bks231/they_should_make_a_vr_game_where_youre_the/,3,,False,CrazyIdeas,They should make a VR game where you’re the richest human being that has ever lived and you can create any technology that you want and you’re basically God.,https://www.reddit.com/r/CrazyIdeas/comments/bks231/they_should_make_a_vr_game_where_youre_the/
305,Guignol1981,t3_bkt762,0,/r/CrazyIdeas/comments/bkt762/there_should_be_a_test_to_prove_that_ads_dont/,3,,False,CrazyIdeas,There should be a test to prove that ads don’t affect your consommation behaviour. Then with the certificate you could disable ads on websites for free.,https://www.reddit.com/r/CrazyIdeas/comments/bkt762/there_should_be_a_test_to_prove_that_ads_dont/
306,JimbobobaboBob,t3_bkwdjf,0,/r/CrazyIdeas/comments/bkwdjf/a_horribly_racist_tv_show/,0,"Called ""Secret Asian-t"" and it's about a white undercover immigration officer who targets only people from Asia",False,CrazyIdeas,A horribly racist tv show,https://www.reddit.com/r/CrazyIdeas/comments/bkwdjf/a_horribly_racist_tv_show/
307,uniqueusername831,t3_bkunns,2,/r/CrazyIdeas/comments/bkunns/carve_watermelons_on_halloween/,1,,False,CrazyIdeas,Carve watermelons on Halloween,https://www.reddit.com/r/CrazyIdeas/comments/bkunns/carve_watermelons_on_halloween/
